Title,Description,Runtime,Genre,Year
The Shawshank Redemption,"Two imprisoned men bond over a number of years, finding solace and eventual redemption through acts of common decency.",142,Drama            ,1994
The Godfather,The aging patriarch of an organized crime dynasty transfers control of his clandestine empire to his reluctant son.,175,"Crime, Drama            ",1972
Joker,"In Gotham City, mentally-troubled comedian Arthur Fleck embarks on a downward-spiral of social revolution and bloody crime. This path brings him face-to-face with his infamous alter-ego: ""The Joker"".",122,"Crime, Drama, Thriller            ",2019
The Dark Knight,"When the menace known as The Joker emerges from his mysterious past, he wreaks havoc and chaos on the people of Gotham. The Dark Knight must accept one of the greatest psychological and physical tests of his ability to fight injustice.",152,"Action, Crime, Drama            ",2008
The Godfather: Part II,"The early life and career of Vito Corleone in 1920s New York City is portrayed, while his son, Michael, expands and tightens his grip on the family crime syndicate.",202,"Crime, Drama            ",1974
The Lord of the Rings: The Return of the King,Gandalf and Aragorn lead the World of Men against Sauron's army to draw his gaze from Frodo and Sam as they approach Mount Doom with the One Ring.,201,"Adventure, Drama, Fantasy            ",2003
Pulp Fiction,"The lives of two mob hitmen, a boxer, a gangster and his wife, and a pair of diner bandits intertwine in four tales of violence and redemption.",154,"Crime, Drama            ",1994
Schindler's List,"In German-occupied Poland during World War II, industrialist Oskar Schindler gradually becomes concerned for his Jewish workforce after witnessing their persecution by the Nazis.",195,"Biography, Drama, History            ",1993
12 Angry Men,A jury holdout attempts to prevent a miscarriage of justice by forcing his colleagues to reconsider the evidence.,96,Drama            ,1957
Inception,A thief who steals corporate secrets through the use of dream-sharing technology is given the inverse task of planting an idea into the mind of a C.E.O.,148,"Action, Adventure, Sci-Fi            ",2010
Fight Club,"An insomniac office worker and a devil-may-care soapmaker form an underground fight club that evolves into something much, much more.",139,Drama            ,1999
The Lord of the Rings: The Fellowship of the Ring,A meek Hobbit from the Shire and eight companions set out on a journey to destroy the powerful One Ring and save Middle-earth from the Dark Lord Sauron.,178,"Adventure, Drama, Fantasy            ",2001
Forrest Gump,"The presidencies of Kennedy and Johnson, the events of Vietnam, Watergate, and other history unfold through the perspective of an Alabama man with an IQ of 75.",142,"Drama, Romance            ",1994
"Il buono, il brutto, il cattivo",A bounty hunting scam joins two men in an uneasy alliance against a third in a race to find a fortune in gold buried in a remote cemetery.,161,Western            ,1966
Drishyam,A man goes to extreme lengths to save his family from punishment after the family commits an accidental crime.,160,"Crime, Drama, Thriller            ",2013
The Lord of the Rings: The Two Towers,"While Frodo and Sam edge closer to Mordor with the help of the shifty Gollum, the divided fellowship makes a stand against Sauron's new ally, Saruman, and his hordes of Isengard.",179,"Adventure, Drama, Fantasy            ",2002
The Matrix,A computer hacker learns from mysterious rebels about the true nature of his reality and his role in the war against its controllers.,136,"Action, Sci-Fi            ",1999
Goodfellas,"The story of Henry Hill and his life in the mob, covering his relationship with his wife Karen Hill and his mob partners Jimmy Conway and Tommy DeVito in the Italian-American crime syndicate.",146,"Biography, Crime, Drama            ",1990
Star Wars: Episode V - The Empire Strikes Back,"After the Rebels are brutally overpowered by the Empire on the ice planet Hoth, Luke Skywalker begins Jedi training with Yoda, while his friends are pursued by Darth Vader.",124,"Action, Adventure, Fantasy            ",1980
One Flew Over the Cuckoo's Nest,A criminal pleads insanity after getting into trouble again and once in the mental institution rebels against the oppressive nurse and rallies up the scared patients.,133,Drama            ,1975
Seppuku,An elder ronin samurai arrives at a feudal lord's home and requests an honorable place to commit suicide. But when the ronin inquires about a younger samurai who arrived before him things take an unexpected turn.,133,"Drama, History            ",1962
Avengers: Endgame,"After the devastating events of Avengers: Infinity War (2018), the universe is in ruins. With the help of remaining allies, the Avengers assemble once more in order to reverse Thanos' actions and restore balance to the universe.",181,"Action, Adventure, Sci-Fi            ",2019
Interstellar,A team of explorers travel through a wormhole in space in an attempt to ensure humanity's survival.,169,"Adventure, Drama, Sci-Fi            ",2014
Cidade de Deus,"In the slums of Rio, two kids' paths diverge as one struggles to become a photographer and the other a kingpin.",130,"Crime, Drama            ",2002
Sen to Chihiro no kamikakushi,"During her family's move to the suburbs, a sullen 10-year-old girl wanders into a world ruled by gods, witches, and spirits, and where humans are changed into beasts.",125,"Animation, Adventure, Family            ",2001
Saving Private Ryan,"Following the Normandy Landings, a group of U.S. soldiers go behind enemy lines to retrieve a paratrooper whose brothers have been killed in action.",169,"Drama, War            ",1998
The Green Mile,"The lives of guards on Death Row are affected by one of their charges: a black man accused of child murder and rape, yet who has a mysterious gift.",189,"Crime, Drama, Fantasy            ",1999
La vita è bella,"When an open-minded Jewish librarian and his son become victims of the Holocaust, he uses a perfect mixture of will, humor, and imagination to protect his son from the dangers around their camp.",116,"Comedy, Drama, Romance            ",1997
Se7en,"Two detectives, a rookie and a veteran, hunt a serial killer who uses the seven deadly sins as his motives.",127,"Crime, Drama, Mystery            ",1995
The Silence of the Lambs,"A young F.B.I. cadet must receive the help of an incarcerated and manipulative cannibal killer to help catch another serial killer, a madman who skins his victims.",118,"Crime, Drama, Thriller            ",1991
Star Wars,"Luke Skywalker joins forces with a Jedi Knight, a cocky pilot, a Wookiee and two droids to save the galaxy from the Empire's world-destroying battle station, while also attempting to rescue Princess Leia from the mysterious Darth Vader.",121,"Action, Adventure, Fantasy            ",1977
Shichinin no samurai,A poor village under attack by bandits recruits seven unemployed samurai to help them defend themselves.,207,"Adventure, Drama            ",1954
It's a Wonderful Life,An angel is sent from Heaven to help a desperately frustrated businessman by showing him what life would have been like if he had never existed.,130,"Drama, Family, Fantasy            ",1946
Gisaengchung,"All unemployed, Ki-taek's family takes peculiar interest in the wealthy and glamorous Parks for their livelihood until they get entangled in an unexpected incident.",132,"Comedy, Drama, Thriller            ",2019
Avengers: Infinity War,The Avengers and their allies must be willing to sacrifice all in an attempt to defeat the powerful Thanos before his blitz of devastation and ruin puts an end to the universe.,149,"Action, Adventure, Sci-Fi            ",2018
Whiplash,A promising young drummer enrolls at a cut-throat music conservatory where his dreams of greatness are mentored by an instructor who will stop at nothing to realize a student's potential.,106,"Drama, Music            ",2014
The Intouchables,"After he becomes a quadriplegic from a paragliding accident, an aristocrat hires a young man from the projects to be his caregiver.",112,"Biography, Comedy, Drama            ",2011
The Prestige,"After a tragic accident, two stage magicians engage in a battle to create the ultimate illusion while sacrificing everything they have to outwit each other.",130,"Drama, Mystery, Sci-Fi            ",2006
The Departed,An undercover cop and a mole in the police attempt to identify each other while infiltrating an Irish gang in South Boston.,151,"Crime, Drama, Thriller            ",2006
The Pianist,A Polish Jewish musician struggles to survive the destruction of the Warsaw ghetto of World War II.,150,"Biography, Drama, Music            ",2002
Gladiator,A former Roman General sets out to exact vengeance against the corrupt emperor who murdered his family and sent him into slavery.,155,"Action, Adventure, Drama            ",2000
American History X,A former neo-nazi skinhead tries to prevent his younger brother from going down the same wrong path that he did.,119,Drama            ,1998
The Usual Suspects,"A sole survivor tells of the twisty events leading up to a horrific gun battle on a boat, which began when five criminals met at a seemingly random police lineup.",106,"Crime, Mystery, Thriller            ",1995
Léon,"Mathilda, a 12-year-old girl, is reluctantly taken in by Léon, a professional assassin, after her family is murdered. Léon and Mathilda form an unusual relationship, as she becomes his protégée and learns the assassin's trade.",110,"Action, Crime, Drama            ",1994
The Lion King,"A Lion cub crown prince is tricked by a treacherous uncle into thinking he caused his father's death and flees into exile in despair, only to learn in adulthood his identity and his responsibilities.",88,"Animation, Adventure, Drama            ",1994
Terminator 2: Judgment Day,"A cyborg, identical to the one who failed to kill Sarah Connor, must now protect her teenage son, John Connor, from a more advanced and powerful cyborg.",137,"Action, Sci-Fi            ",1991
Nuovo Cinema Paradiso,A filmmaker recalls his childhood when falling in love with the pictures at the cinema of his home village and forms a deep friendship with the cinema's projectionist.,155,Drama            ,1988
Hotaru no haka,A young boy and his little sister struggle to survive in Japan during World War II.,89,"Animation, Drama, War            ",1988
Back to the Future,"Marty McFly, a 17-year-old high school student, is accidentally sent thirty years into the past in a time-traveling DeLorean invented by his close friend, the maverick scientist Doc Brown.",116,"Adventure, Comedy, Sci-Fi            ",1985
Once Upon a Time in the West,A mysterious stranger with a harmonica joins forces with a notorious desperado to protect a beautiful widow from a ruthless assassin working for the railroad.,165,Western            ,1968
Psycho,"A Phoenix secretary embezzles forty thousand dollars from her employer's client, goes on the run, and checks into a remote motel run by a young man under the domination of his mother.",109,"Horror, Mystery, Thriller            ",1960
Rear Window,A wheelchair-bound photographer spies on his neighbors from his apartment window and becomes convinced one of them has committed murder.,112,"Mystery, Thriller            ",1954
Casablanca,A cynical American expatriate struggles to decide whether or not he should help his former lover and her fugitive husband escape French Morocco.,102,"Drama, Romance, War            ",1942
The Great Dictator,Dictator Adenoid Hynkel tries to expand his empire while a poor Jewish barber tries to avoid persecution from Hynkel's regime.,125,"Comedy, Drama, War            ",1940
Modern Times,The Tramp struggles to live in modern industrial society with the help of a young homeless woman.,87,"Comedy, Drama, Family            ",1936
City Lights,"With the aid of a wealthy erratic tippler, a dewy-eyed tramp who has fallen in love with a sightless flower girl accumulates money to be able to help her medically.",87,"Comedy, Drama, Romance            ",1931
Capharnaüm,"While serving a five-year sentence for a violent crime, a 12-year-old boy sues his parents for neglect.",126,Drama            ,2018
Andhadhun,A series of mysterious events change the life of a blind pianist who now must report a crime that was actually never witnessed by him.,139,"Crime, Thriller            ",2018
Kimi no na wa.,"Two strangers find themselves linked in a bizarre way. When a connection forms, will distance be the only thing to keep them apart?",106,"Animation, Drama, Fantasy            ",2016
Dangal,Former wrestler Mahavir Singh Phogat and his two wrestler daughters struggle towards glory at the Commonwealth Games in the face of societal oppression.,161,"Action, Biography, Drama            ",2016
Spider-Man: Into the Spider-Verse,"Teen Miles Morales becomes Spider-Man of his reality, crossing his path with five counterparts from other dimensions to stop a threat for all realities.",117,"Animation, Action, Adventure            ",2018
Coco,"Aspiring musician Miguel, confronted with his family's ancestral ban on music, enters the Land of the Dead to find his great-great-grandfather, a legendary singer.",105,"Animation, Adventure, Family            ",I 2017
Django Unchained,"With the help of a German bounty hunter, a freed slave sets out to rescue his wife from a brutal Mississippi plantation owner.",165,"Drama, Western            ",2012
The Dark Knight Rises,"Eight years after the Joker's reign of anarchy, Batman, with the help of the enigmatic Catwoman, is forced from his exile to save Gotham City, now on the edge of total annihilation, from the brutal guerrilla terrorist Bane.",164,"Action, Thriller            ",2012
3 Idiots,"Two friends are searching for their long lost companion. They revisit their college days and recall the memories of their friend who inspired them to think differently, even as the rest of the world called them ""idiots"".",170,"Comedy, Drama            ",2009
Taare Zameen Par,"An eight-year-old boy is thought to be a lazy trouble-maker, until the new art teacher has the patience and compassion to discover the real problem behind his struggles in school.",165,"Drama, Family            ",2007
WALL·E,"In the distant future, a small waste-collecting robot inadvertently embarks on a space journey that will ultimately decide the fate of mankind.",98,"Animation, Adventure, Family            ",2008
The Lives of Others,"In 1984 East Berlin, an agent of the secret police, conducting surveillance on a writer and his lover, finds himself becoming increasingly absorbed by their lives.",137,"Drama, Thriller            ",2006
Oldeuboi,"After being kidnapped and imprisoned for fifteen years, Oh Dae-Su is released, only to find that he must find his captor in five days.",120,"Action, Drama, Mystery            ",2003
Memento,A man with short-term memory loss attempts to track down his wife's murderer.,113,"Mystery, Thriller            ",2000
Mononoke-hime,"On a journey to find the cure for a Tatarigami's curse, Ashitaka finds himself in the middle of a war between the forest gods and Tatara, a mining colony. In this quest he also meets San, the Mononoke Hime.",134,"Animation, Adventure, Fantasy            ",1997
Aliens,"Ellen Ripley is rescued by a deep salvage team after being in hypersleep for 57 years. The moon that the Nostromo visited has been colonized, but contact is lost. This time, colonial marines have impressive firepower, but will that be enough?",137,"Action, Adventure, Sci-Fi            ",1986
Once Upon a Time in America,"A former Prohibition-era Jewish gangster returns to the Lower East Side of Manhattan over thirty years later, where he once again must confront the ghosts and regrets of his old life.",229,"Crime, Drama            ",1984
Raiders of the Lost Ark,"In 1936, archaeologist and adventurer Indiana Jones is hired by the U.S. government to find the Ark of the Covenant before Adolf Hitler's Nazis can obtain its awesome powers.",115,"Action, Adventure            ",1981
The Shining,"A family heads to an isolated hotel for the winter where a sinister presence influences the father into violence, while his psychic son sees horrific forebodings from both past and future.",146,"Drama, Horror            ",1980
Apocalypse Now,A U.S. Army officer serving in Vietnam is tasked with assassinating a renegade Special Forces Colonel who sees himself as a god.,147,"Drama, Mystery, War            ",1979
Alien,"After a space merchant vessel perceives an unknown transmission as a distress call, its landing on the source moon finds one of the crew attacked by a mysterious lifeform, and they soon realize that its life cycle has merely begun.",117,"Horror, Sci-Fi            ",1979
Dr. Strangelove or: How I Learned to Stop Worrying and Love the Bomb,An insane general triggers a path to nuclear holocaust that a War Room full of politicians and generals frantically tries to stop.,95,Comedy            ,1964
Witness for the Prosecution,A veteran British barrister must defend his client in a murder trial that has surprise after surprise.,116,"Crime, Drama, Film-Noir            ",1957
Paths of Glory,"After refusing to attack an enemy position, a general accuses the soldiers of cowardice and their commanding officer must defend them.",88,"Drama, War            ",1957
Sunset Blvd.,A screenwriter develops a dangerous relationship with a faded film star determined to make a triumphant return.,110,"Drama, Film-Noir            ",1950
Drishyam,"Desperate measures are taken by a man who tries to save his family from the dark side of the law, after they commit an unexpected crime.",163,"Crime, Drama, Mystery            ",2015
Jagten,"A teacher lives a lonely life, all the while struggling over his son's custody. His life slowly gets better as he finds love and receives good news from his son, but his new luck is about to be brutally shattered by an innocent little lie.",115,Drama            ,2012
Jodaeiye Nader az Simin,A married couple are faced with a difficult decision - to improve the life of their child by moving to another country or to stay in Iran and look after a deteriorating parent who has Alzheimer's disease.,123,"Drama, Thriller            ",2011
Incendies,Twins journey to the Middle East to discover their family history and fulfill their mother's last wishes.,131,"Drama, Mystery, War            ",2010
Babam ve Oglum,The family of a left-wing journalist is torn apart after a military coup in 1980's Turkey.,108,"Drama, Family            ",2005
Toy Story 3,"The toys are mistakenly delivered to a day-care center instead of the attic right before Andy leaves for college, and it's up to Woody to convince the other toys that they weren't abandoned and to return home.",103,"Animation, Adventure, Comedy            ",2010
Inglourious Basterds,"In Nazi-occupied France during World War II, a plan to assassinate Nazi leaders by a group of Jewish U.S. soldiers coincides with a theatre owner's vengeful plans for the same.",153,"Adventure, Drama, War            ",2009
Eternal Sunshine of the Spotless Mind,"When their relationship turns sour, a couple undergoes a medical procedure to have each other erased from their memories.",108,"Drama, Romance, Sci-Fi            ",2004
Amélie,"Amélie is an innocent and naive girl in Paris with her own sense of justice. She decides to help those around her and, along the way, discovers love.",122,"Comedy, Romance            ",2001
Snatch,"Unscrupulous boxing promoters, violent bookmakers, a Russian gangster, incompetent amateur robbers and supposedly Jewish jewelers fight to track down a priceless stolen diamond.",104,"Comedy, Crime            ",2000
Requiem for a Dream,The drug-induced utopias of four Coney Island people are shattered when their addictions run deep.,102,Drama            ,2000
American Beauty,A sexually frustrated suburban father has a mid-life crisis after becoming infatuated with his daughter's best friend.,122,Drama            ,1999
Good Will Hunting,"Will Hunting, a janitor at M.I.T., has a gift for mathematics, but needs help from a psychologist to find direction in his life.",126,"Drama, Romance            ",1997
Bacheha-Ye aseman,"After a boy loses his sister's pair of shoes, he goes on a series of adventures in order to find them. When he can't, he tries a new way to ""win"" a new pair.",89,"Drama, Family            ",1997
Eskiya,"Baran the Bandit, released from prison after 35 years searches for vengeance and his lover.",128,"Crime, Drama, Thriller            ",1996
Toy Story,A cowboy doll is profoundly threatened and jealous when a new spaceman figure supplants him as top toy in a boy's room.,81,"Animation, Adventure, Comedy            ",1995
Braveheart,"When his secret bride is executed for assaulting an English soldier who tried to rape her, William Wallace begins a revolt against King Edward I of England.",178,"Biography, Drama, History            ",1995
Reservoir Dogs,"When a simple jewelry heist goes horribly wrong, the surviving criminals begin to suspect that one of them is a police informant.",99,"Crime, Drama, Thriller            ",1992
Full Metal Jacket,A pragmatic U.S. Marine observes the dehumanizing effects the Vietnam War has on his fellow recruits from their brutal boot camp training to the bloody street fighting in Hue.,116,"Drama, War            ",1987
Idi i smotri,"After finding an old rifle, a young boy joins the Soviet resistance movement against ruthless German forces and experiences the horrors of World War II.",142,"Drama, War            ",1985
Amadeus,"The life, success and troubles of Wolfgang Amadeus Mozart, as told by Antonio Salieri, the contemporaneous composer who was insanely jealous of Mozart's talent and claimed to have murdered him.",160,"Biography, Drama, History            ",1984
Scarface,"In 1980 Miami, a determined Cuban immigrant takes over a drug cartel and succumbs to greed.",170,"Crime, Drama            ",1983
Star Wars: Episode VI - Return of the Jedi,"After a daring mission to rescue Han Solo from Jabba the Hutt, the Rebels dispatch to Endor to destroy the second Death Star. Meanwhile, Luke struggles to help Darth Vader back from the dark side without falling into the Emperor's trap.",131,"Action, Adventure, Fantasy            ",1983
Das Boot,"The claustrophobic world of a WWII German U-boat; boredom, filth and sheer terror.",149,"Adventure, Drama, Thriller            ",1981
Taxi Driver,"A mentally unstable veteran works as a nighttime taxi driver in New York City, where the perceived decadence and sleaze fuels his urge for violent action by attempting to liberate a presidential campaign worker and an underage prostitute.",114,"Crime, Drama            ",1976
The Sting,Two grifters team up to pull off the ultimate con.,129,"Comedy, Crime, Drama            ",1973
A Clockwork Orange,"In the future, a sadistic gang leader is imprisoned and volunteers for a conduct-aversion experiment, but it doesn't go as planned.",136,"Crime, Drama, Sci-Fi            ",1971
2001: A Space Odyssey,"After discovering a mysterious artifact buried beneath the Lunar surface, mankind sets off on a quest to find its origins with help from intelligent supercomputer H.A.L. 9000.",149,"Adventure, Sci-Fi            ",1968
Per qualche dollaro in più,Two bounty hunters with the same intentions team up to track down a Western outlaw.,132,Western            ,1965
To Kill a Mockingbird,"Atticus Finch, a lawyer in the Depression-era South, defends a black man against an undeserved rape charge, and his children against prejudice.",129,"Crime, Drama            ",1962
Lawrence of Arabia,"The story of T.E. Lawrence, the English officer who successfully united and led the diverse, often warring, Arab tribes during World War I in order to fight the Turks.",228,"Adventure, Biography, Drama            ",1962
The Apartment,"A man tries to rise in his company by letting its executives use his apartment for trysts, but complications and a romance of his own ensue.",125,"Comedy, Drama, Romance            ",1960
North by Northwest,A New York City advertising executive goes on the run after being mistaken for a government agent by a group of foreign spies.,136,"Adventure, Mystery, Thriller            ",1959
Vertigo,A former police detective juggles wrestling with his personal demons and becoming obsessed with a hauntingly beautiful woman.,128,"Mystery, Romance, Thriller            ",1958
Singin' in the Rain,A silent film production company and cast make a difficult transition to sound.,103,"Comedy, Musical, Romance            ",1952
Ikiru,A bureaucrat tries to find a meaning in his life after he discovers he has terminal cancer.,143,Drama            ,1952
Ladri di biciclette,"In post-war Italy, a working-class man's bicycle is stolen. He and his son set out to find it.",89,Drama            ,1948
Double Indemnity,An insurance representative lets himself be talked by a seductive housewife into a murder/insurance fraud scheme that arouses the suspicion of an insurance investigator.,107,"Crime, Drama, Film-Noir            ",1944
Citizen Kane,"Following the death of publishing tycoon, Charles Foster Kane, reporters scramble to uncover the meaning of his final utterance; 'Rosebud'.",119,"Drama, Mystery            ",1941
M - Eine Stadt sucht einen Mörder,"When the police in a German city are unable to catch a child-murderer, other criminals join in the manhunt.",117,"Crime, Mystery, Thriller            ",1931
Metropolis,"In a futuristic city sharply divided between the working class and the city planners, the son of the city's mastermind falls in love with a working class prophet who predicts the coming of a savior to mediate their differences.",153,"Drama, Sci-Fi            ",1927
