title,price,weight,count_sold,seller,feedback_seller
Sendok Teh Panjang Stainless 1 Lusin,10000,150 gram,7.0,tokogk38,97% (218 feedback)
Coffee dan tea Warmer Mesin Penghangat Kopi & teh Getra CM-0521 ,472000,3.0 kilogram,10.0,matthew704,93% (198 feedback)
Teh Upet Celup Teh Khas Cirebon produksi CV Sariwangi,15000,150 gram,19.0,yulianyyen,98% (224 feedback)
teh herbal daun pinus bubuk,40500,150 gram,12.0,ardhi_shope,98% (75 feedback)
TEH GARDOE AROMA MELATI,30000,600 gram,16.0,qupret_herry,98% (1290 feedback)
TEH JATI CINA ORGANIK 100 gr,19500,150 gram,5.0,flozindo,100% (4069 feedback)
Daun benalu teh bubuk 1000 gram,70000,1.1 kilogram,6.0,ari_ramadani,99% (2254 feedback)
BUBUK REGULER TIRAMISU 1KG,44000,1.05 kilogram,5.0,kedaibubukjaksel,97% (1843 feedback)
Promo Murah Wedang Uwuh Secang Wangi Teh Seduh Plus Lengkap Gula Batu SALE,2600,30 gram,24.0,toracyber,100% (107 feedback)
Hawthorn Tea 20g Herbal Tea Teh Kesehatan,26000,30 gram,13.0,syah_city,97% (449 feedback)
Teh Celup Benalu Obat Herbal Untuk Penyakit Epilepsi Tidur Mendengkur Detak Jantung Tidak Normal Hepatitis Mencegah Keguguran Pendarahan Kehamilan,20000,200 gram,0.0,hamzahmulyanto,99% (273 feedback)
teh hijau yabukita asli termurah,58500,50 gram,0.0,dekaprasetyo,0% (0 feedback)
Kangxingda 1200ml Tempat Minum Air Teh Kopi Teko Kaca Water Jug Botol,64000,2.0 kilogram,0.0,grosirsupermarketgan,96% (1737 feedback)
teh thermo--he rbalife-.,279000,300 gram,0.0,naningmarisah,98% (239 feedback)
ASLI Teh Celup Isi 20 tea bag - Teh Daun Kelor Kencono Sari - Diabetes Alergi,15000,80 gram,0.0,herbaltum,88% (1010 feedback)
Teh cap Kepala Djenggot jenggot tea melati 10 pak pack seduh oleh khas Solo Harum baunya segar enak,26500,600 gram,2.0,theeagles,98% (214 feedback)
Teh Seduh Bunga Rosella Ungu Kencono Sari Herbal Kolesterol - Maag - sariawan,19000,100 gram,0.0,herbaltum,88% (1010 feedback)
hiasan dinding kayu jati Belanda poster wall decor Vintage retro dekorasi papan nama pajangan kafe dapur kitchen cafe TEA cangkir teh,120000,1.0 kilogram,2.0,yudiazka,98% (1525 feedback)
Tea Ball Infuser - Saringan Teh Bola Jepit Filter Stainless Strainer,27000,200 gram,0.0,klikmystore,97% (11543 feedback)
Herbal-Teh-Jamblang-Duwet-Juwet-Duwet Manting-JambuKling-JambeKleng-Jambu Kalang-Dhalas-Klayu-Duwe-Jambulan-RaporapoJawa-Alicopeng-Jambula,155500,65 gram,2.0,nmqueennov,100% (12 feedback)
Teh Celup ASIKU Teh Pelancar ASI Terbaik Teh ASI Booster Tea Teh Ibu Menyusui Obat Herbal Untuk Melancarkan Pelancar Asi Alami Asi Breastmilk Booster,20000,100 gram,1.0,hamzahmulyanto,99% (273 feedback)
TEH HITAM Cap Keris 100 Gram,11500,105 gram,177.0,safii3010,95% (42 feedback)
Teh Yogi Blueberry Slim Life 16 pcs 32 gram Penambah Support Energi GreenTea Green Tea Bluebery Suport Progam Diet Penurun Berat Badan BB ,180600,300 gram,0.0,raravits,99% (1325 feedback)
teh pelangsing termurah,14000,100 gram,0.0,daniherba,100% (5 feedback)
Timbangan Digital Dagang 30 kg Komersial Usaha Harga Tare 30kg Kitchen Scale Kopi Teh Batu Akik,389000,2.5 kilogram,0.0,jktgrand,99% (13031 feedback)
Jati cina - teh jati cina 500 gram,27000,500 gram,0.0,tradecentresby88,0% (0 feedback)
Kemasan Sachet Transmetz Silver 25 Gram. Kemasan Kopi. Kemasan Teh. Kemasan Bumbu bubuk kopi snack,400,2 gram,0.0,kemasanjayaindo,99% (590 feedback)
Tea4life original tranfer factor tea 4life teh herbal kesehatan isi 30sachet,300000,150 gram,0.0,hengki_sung,99% (113 feedback)
Paket Sehat Anti Kanker 2 botol Ama Zon Plus 1 Box Besar teh keladi Tikus Muri Cata isi 30 sachet ,775000,2.5 kilogram,0.0,jericho_ng,98% (2526 feedback)
Asipartan Sendok Teh Kopi Rainbow Spoon Tea Coffee Time Model Lonjong,17600,100 gram,0.0,lapakmasdedi,98% (8725 feedback)
Teh sarang semut,19000,200 gram,27.0,salamah01,99% (2227 feedback)
Herbs Tea - Teh Mint - Daun Mint Kering - Dried Mint Leaves,7500,50 gram,40.0,mettamilk,100% (1562 feedback)
Saringan Minyak. Teh. Kopi Dan Kelapa Diameter 22cm,22000,140 gram,5.0,onlineshopmainan,99% (7205 feedback)
Lohankuo Zhenzhu Juhua teh untuk panas dalam,21500,250 gram,19.0,herbaleo,99% (544 feedback)
Paket Teko Kopi Teh Tembaga Kuningan - Saringan Warung Kopi Warkop Kopi Tiam,360000,1.15 kilogram,9.0,sandyptk,100% (1419 feedback)
Teh Celup Manjakani Plus Kacip Fatimah Darusyifa,13900,60 gram,12.0,salehaffif,99% (10833 feedback)
EVERSLIM PREMIUM TEA BY EVERWHITE TEH DETOX PELANGSING,95000,150 gram,5.0,rumahcantiq1,98% (8000 feedback)
Saringan Sendok Penyeduh Penyaring Teh Rempah Tea Strainer Melody Nada,12900,100 gram,10.0,fantasyland,97% (2041 feedback)
"paket bandrek instan extra rempah2 / isi 9 rasa /teh bandrek,beras cikur,coklat bandrek,kopi bandrek,kopi bajigur dll",26000,300 gram,11.0,inas_harun,100% (3933 feedback)
TEH JATI CINA (1 kg),45000,1.0 kilogram,13.0,anherbal89,99% (614 feedback)
TEH MURNI NAGA,12500,200 gram,6.0,snishop_prigen,100% (2368 feedback)
Jamu Herbal Teh Diet Daun Jati Cina Bubuk 250 gr untuk pelangsing Badan,22000,300 gram,8.0,sarijamu,99% (1052 feedback)
Crystal Body Deodorant Chamomile Green Tea 66ml Teh Hijau Pencegah Bau Badan Pembersih Kulit Dedorant Krystal Dedoran Bodi Deodoran 66 ml,170000,100 gram,26.0,nuria408,100% (250 feedback)
Teh Herbal Daun Seledri,22000,80 gram,8.0,adnan_hendra,100% (398 feedback)
Tanaman pagar teh tehan / pohon tehtehan / pangkas hijau,6000,50 gram,190.0,sansiveragroup,91% (378 feedback)
Wadah Kopi - Gula - Teh,63000,1.3 kilogram,40.0,rahmat_bgr,94% (3614 feedback)
Teh Celup Benalu Original Sari Gunung Solusi Epilepsi Pendarahan Jantung - Teh Daun Benalu - Benalu Teh Alami - Teh Benalu Asli,34200,45 gram,9.0,liewind,100% (4232 feedback)
Teh Seduh DAUN AFRIKA Hikmah,6000,60 gram,16.0,muliashop,96% (7024 feedback)
Wooden Coaster 7 Cm Tatakan gelas cangkir kopi teh Tatakan kayu unik,2500,40 gram,22.0,lapaksangkayu,96% (549 feedback)
teh hijau 313 cap pohon kurma,28500,100 gram,32.0,fadel_ibrahim739,100% (7 feedback)
TEH CELUP DAUN SIRSAK ,12500,100 gram,38.0,almanna_herbal,99% (706 feedback)
Teh Tiwai - Bawang Dayak Rajang Kering 1 Kg,91000,1.1 kilogram,20.0,centralbawangdayak,97% (103 feedback)
Korean Roasted Corn Tea 1kg Oksusucha Teh Jagung Korea Import,110000,1.2 kilogram,16.0,1stop4all,93% (1287 feedback)
teh kemasan aroma terapi,250000,150 gram,17.0,tedi_wicaksono69,100% (39 feedback)
Teh Celup Kulit Manggis,10000,50 gram,42.0,amirah01,95% (1160 feedback)
PD020 SENDOK MOTIF BUNGA GOLD STENLIS STAINLESS STEEL SENDOK TEH KUE KOPI CAKE SPOON,10900,85 gram,40.0,ahokistore,94% (5478 feedback)
Teh Hijau celup Kepala Djenggot isi 25 pcs,12500,100 gram,22.0,healthy_herbal,99% (2655 feedback)
Kataoka Tsujiri Matcha Milk Japan Green Tea Latte Teh Hijau Jepang,145000,500 gram,12.0,1stop4all,93% (1287 feedback)
Tong Tji 50 gram-Original Tea-Teh Seduh-Loose Tea - per slop 10 pcs,26000,780 gram,35.0,tongtjiofficialstore,93% (250 feedback)
Teh Daun Jati Cina,8000,100 gram,15.0,mona_ips,97% (1888 feedback)
TEH CELUP KERSEN OBAT DIABETES HERBAL MANJUR BUKTI NYATA PENGALAMAN PRIBADI MENDERITA DIABETES. SEHAT BEBAS DARI DIABETES OBAT & INSULIN ,60000,100 gram,5.0,hermansyah911,100% (59 feedback)
new teko teh thai teko teh tarik teko stainles ,85000,1.2 kilogram,3.0,bayusinta,79% (113 feedback)
Teh gede dan mini etham,100000,250 gram,1.0,wei90,100% (601 feedback)
Teh Daduzi Original Jaco 1 Box 30 Sachet Minuman Pelangsing Detox,355100,300 gram,0.0,sutrasehat,96% (65 feedback)
Teh Bunga Rosella Merah Konco Sari Curah Original Herbal Organik Alami,25000,120 gram,0.0,hasan_ahril930,99% (184 feedback)
TEH PELANGSING AMPUH TEH PELANGSING AMAN OYAMA SLIM  TERBARU DAN SANGAT AMPUH TANPA EFEK SAMPING,110000,155 gram,0.0,deniardianshop,100% (11934 feedback)
Teh Celup Herbal Sarang Semut Obat Herbal Untuk Penyakit Migrain Migren Benjolan Dipayudara Melancarkan Haid,20000,250 gram,0.0,hamzahmulyanto,99% (273 feedback)
Teh ASI - Breast milk Booster Tea - Herbal Lancar ASI plus Daun Katuk,25000,100 gram,0.0,ozejk11,99% (1275 feedback)
TEH CELUP Cap Dandang,6000,50 gram,0.0,warungmakkunapah,100% (8 feedback)
Teh Seduh - Curah Daun Kelor,7000,50 gram,11.0,pasukanherbal,91% (34 feedback)
Teh Seduh - Curah Daun Kelor,7000,50 gram,11.0,pasukanherbal,91% (34 feedback)
Nu TEKO TEH TARIK POT COLD TEA KOPI DINGIN 2LITER ANTI KARAT N23-f4M,158200,1.25 kilogram,1.0,kedailaku,99% (1126 feedback)
Fat Yan Tea Mei Fah Brand Fei Yan Teh Dewi Pelangsing Herbal Alami,60000,300 gram,0.0,suhendy2005,98% (1888 feedback)
Jual Teh Hitam Gold Tea   Teh Kesehatan Goldtea,75000,50 gram,0.0,ssmartcilacap,100% (1 feedback)
luma smile alat pemutih gigi yg sering ngopi rokok teh dll js,55000,650 gram,0.0,windaanggraini15,99% (1456 feedback)
TEH CELUP ROSELLA ISI 10 SERAMBI BOTANI HEALTHY & NATURAL PRODUCTS,65600,30 gram,0.0,bogoridstore,100% (426 feedback)
Teh Seduh kelor Moringa - Teh Daun Kelor Hikmah Sehat Kaya Vitamin dan Nutrisi,12000,80 gram,0.0,herbaltum,88% (1010 feedback)
Teko enamel seng blurik teh poci teko kopi untuk dirumah atau bisa untuk camping outdoor piknik,48500,450 gram,0.0,gigii,91% (58 feedback)
teh herbulgari aslii alami herbal alami ampuh Untuk memperlancarkan peredaran darah rematik syaraf kejepit dll 1pack isi 10sachet ,240000,100 gram,0.0,hengki_sung,99% (113 feedback)
Twinings Herbal Tea teh Honeybush Mandarin dan Orange Caffeine Free 20 Individual Tea Bags,79000,200 gram,0.0,beautysta,100% (498 feedback)
PROMO.... Teh Tarikk Max Tea 1 renceng isi 10 sachet x 25gram,21000,220 gram,9.0,dianprima,99% (71386 feedback)
tea bag filter kantong saringan teh,25000,20 gram,20.0,mogalaku,94% (828 feedback)
Saringan teh,11000,300 gram,5.0,miya_mayu,100% (63 feedback)
Teh Celup Herbal Daun Sirsak-Soursop Leaf Tea,16000,95 gram,16.0,mracanganonline,98% (3894 feedback)
Teko Air Teh Kopi Bulat Saringan Stenlis Stainless 16 Cm,43000,600 gram,5.0,perabotku,93% (1137 feedback)
"Teh Gunung Satria Aroma Melati  (Teh Khas Banjar Aroma Melati,teh Gunung Satria Aroma Jasmine",7500,100 gram,13.0,goegun,99% (866 feedback)
teh gunung satria khas banjarmasin bungkus warna merah,5000,100 gram,55.0,goegun,99% (866 feedback)
Teh Jawa Biru Seperasi,2700,70 gram,13.0,williamsantoso,98% (1732 feedback)
Saringan kain teh  kopi  susu  kedelai  almond TOP,49000,100 gram,4.0,galericantik,100% (3984 feedback)
Teh Jawa Hijau Green Tea Celup Amplop Envelope 25 Kantong Kantung Kering GTEn,9300,125 gram,51.0,zephyrus_anastasia,97% (272 feedback)
Pocari sweat 350ml,5600,600 gram,0.0,bros_perak,99% (5337 feedback)
Jiaogulan Tea - Teh Kolesterol / Mengurangi Lemak Darah,65000,200 gram,30.0,toko_obat_hauw,99% (1028 feedback)
Gelas Teh Gagang Putih Bening 325ml  6 Pcs - Golden Dragon 853,85000,1.082 kilogram,13.0,abbfamily,99% (7463 feedback)
SARINGAN TEH BENTUK NOT BALOK,9000,50 gram,14.0,kocky168,99% (1263 feedback)
Aik Cheong Teh Tarik Jahe Halia Ginger Milk Tea Beverage 15Sachet,53000,600 gram,21.0,surgabuku,95% (4723 feedback)
Teh daun sirsak whp,15000,40 gram,20.0,salimcollection955,98% (123 feedback)
TEH  BIDARA ARAB Celup,25000,100 gram,8.0,indrawibowo255,95% (847 feedback)
Kantong teh jumbo besar model standart 1000 pcs ukm,90000,180 gram,7.0,henny_dimayanti08,100% (678 feedback)
Sendok Jus Teh Es Krim bkn Lion Star,38000,500 gram,10.0,ayojualan888,96% (77 feedback)
Teh Jahe Kemuning,15000,125 gram,14.0,rumah_teh_kemuning,100% (10 feedback)
Teh Kemuning rasa Serai,15000,125 gram,11.0,rumah_teh_kemuning,100% (10 feedback)
Teh Gopek Celup Melati,8000,100 gram,39.0,huseinsnack,100% (18 feedback)
Teh Keji Beling,24000,125 gram,27.0,distributorteh,100% (1213 feedback)
"teh daun insulin,daun insulin,teh herbal,obat herbal,obat diabetes,asli",7500,40 gram,25.0,kiosherbalsinta,99% (2990 feedback)
Teh celup Rolas original - teh hitam,5800,65 gram,14.0,officialrolas,100% (28 feedback)
TEKO FUJIKA STAINLESS 1500ml CERET ANTI KARAT DAN SARINGAN TEH KOPI,87500,550 gram,9.0,baggageshops,96% (1480 feedback)
Cangkir Teh-Kopi Keramik SANGO CALA LILIES HIJAU 00143.00957,125000,4.3 kilogram,6.0,tokoleo,97% (15759 feedback)
PAKET HEMAT 2BH TEKO THAI TEA TEH TARIK 2BH SARINGAN TEH 2BH MUG STAINLESS ,194000,5.0 kilogram,11.0,meiren,96% (15094 feedback)
"teh daun sirsak celup,teh daun sirsak,teh sirsak,teh herbal,original,asli",15000,200 gram,25.0,kiosherbalsinta,99% (2990 feedback)
Teh Tjap Botol Teh Cap Botol Teh Botol Kaleng Vintage,62500,200 gram,24.0,dzworld,99% (13122 feedback)
promo  beli 5 gratis 5  bibit Stevia plus teh nya ukuran 20cm.up,185000,1.0 kilogram,0.0,gpa,91% (460 feedback)
Termos kecil Kopi Susu Teh original by treein art Hello number,110000,400 gram,1.0,novi_liu,98% (590 feedback)
Minggu Pagi Natural - Green Tea Body Soap - Sabun Teh Hijau Handmade Homemade,20000,110 gram,1.0,minggupagi_natural,100% (9 feedback)
Teh Rosella 10gr - Rosela Kering - Bunga Rosela Merah - Hibiscus Tea,2500,25 gram,1.0,epipio,100% (10 feedback)
Teh hijau green tea Family 100gr kepala djenggot 25 kantung teabags Oleh khas Solo premium segar,14000,100 gram,0.0,theeagles,98% (214 feedback)
Yogi Tea teh Green Tea Blueberry Slim Life 16 Tea Bags 32 gr,99000,100 gram,2.0,beautysta,100% (498 feedback)
teh daun purik,75000,100 gram,0.0,mhd_syamsu_bahri,0% (0 feedback)
teh herbulgari original  teh herbal alami ampuh untuk memperlancarkan peredaran darah rematik syaraf kejepit dll 1pack isi 10sachet ,240000,100 gram,0.0,hengki_sung,99% (113 feedback)
Teh hijau green tea Gardoe 50 gr ekonomis seduh bean daun teh Kepala Djenggot Solo tradisional,6500,100 gram,0.0,theeagles,98% (214 feedback)
Teh Hitam Syameera Mujarobat Obat Kolesterol Diabetes Darah Tinggi Darah Rendah dll,17000,60 gram,0.0,mujarobatt,98% (62 feedback)
Teh Hitam Mujarobat Obat Diabetes Kolesterol Darah Tinggi dan Rendah Dll,17000,60 gram,0.0,mujarobatt,98% (62 feedback)
Teh Daun Jati Cina Original Alami Herbal Organic Tea Peluntur Lemak,8700,50 gram,0.0,sutrasehat,96% (65 feedback)
Paket Silver Tianshi Ori Pelangsing Herbal - Penghancur Lemak Teh Jiang Zhi 1 Box isi 40 Sachet dan Chitin Chitosan isi 100 Kapsul,522000,100 gram,631.0,warungsehaat,98% (1089 feedback)
Teh Hitam Celup PRENDJAK Khas Aroma Tehnya Rasa Unik Vanila Mawar,6500,100 gram,8.0,syukmabook,100% (2055 feedback)
teh hitam premium seduh rolas termurah,12500,100 gram,0.0,dekaprasetyo,0% (0 feedback)
Teh Celup Daun Insulin Asli Alami Original Obat Herbal Untuk Penyakit Diabetes Diabet Kencing Manis Gula,20000,200 gram,0.0,hamzahmulyanto,99% (273 feedback)
Teh Celup Daun Sirsak Akar Mas - Teh Celup Sirsak 20 sachet - Obati Kanker Asma dll,15000,80 gram,0.0,herbaltum,88% (1010 feedback)
Teh penghancur lemak herbal alami ,150000,65 gram,0.0,kusnadi_vitanur,0% (0 feedback)
Teh Hijau Collaskin Matcha Green Tea,200000,250 gram,0.0,linanasa638,0% (1 feedback)
Teh Daun Jati Cina,5000,40 gram,0.0,rifki_maulana978,58% (39 feedback)
Teh Mahkota Dewa Extra Sirih Merah ,18000,180 gram,13.0,tindiarohimah,93% (676 feedback)
chrysanthemum crystals / teh bunga krisan,25000,300 gram,63.0,myhealth,98% (7734 feedback)
Teh Puer Mentah Mini Toucha,4000,5 gram,99.0,tokotehhuangfu,98% (274 feedback)
Teh Rosella Ungu Premium ,12500,300 gram,12.0,flozindo,100% (4069 feedback)
KHUSUS GOJEK-GRAB Cangkir Teh SANGO LIS MAS SEGI 41501 00143.00124,125000,2.5 kilogram,18.0,tokoleo,97% (15759 feedback)
Tea Infuser saringan teh stainless stel tahan panas,12500,20 gram,4.0,radik_wikanto,100% (1468 feedback)
Teh Herbal Tempuyung,24000,125 gram,8.0,distributorteh,100% (1213 feedback)
Saring Teh Warkop Aceh,20000,110 gram,15.0,superkaya,99% (1713 feedback)
teh hijau bubuk atau green tea bubuk 500 gram,40000,550 gram,5.0,aap_supriatna32,99% (882 feedback)
TEH BABY KRISAN KUNING - CHRYSANTHEMUM - TEH BUNGA KUNING - BLOOM YELLOW MUMS FLOWER ARTISAN TEA,15000,25 gram,29.0,mysnackhut,99% (2785 feedback)
MUG kulit & saringan TEH,75000,475 gram,10.0,samin889,99% (1931 feedback)
Indomada Kantong Teh Celup Infuser Saringan Kertas Kopi Paper Filter Tea Bag 6 X 8 Cm 100 Pcs,40000,70 gram,6.0,indomadaniaga,99% (1575 feedback)
Teh Pelangsing Badan Tubuh - Body Slim Herbal Slimming Tea BSH Original Asli Aman Menurunkan Berat Badan dan Diet Murah,58000,150 gram,30.0,beautilo,100% (3031 feedback)
BLOMNING Kaleng kopi teh Ukuran 11x7x20 cm,54900,200 gram,14.0,titipikea,100% (20875 feedback)
Teh Hijau Bin Rais - teh Antioksidan,9000,100 gram,25.0,lenteng_herbal_store,98% (2320 feedback)
Teh Mahkota Dewa Plus Ekstrak Sirih Merah Benalu Teh Hijau,19800,100 gram,10.0,salehaffif,99% (10833 feedback)
Teh Celup Daun Insulin Gholiban isi 20 Sachet,12000,100 gram,11.0,salehaffif,99% (10833 feedback)
Teh celup Hitam Serai 789,6000,80 gram,62.0,arma79,100% (420 feedback)
Teh Hijau Kepala Jenggot Serbuk,14500,130 gram,56.0,lha2olshop,94% (1528 feedback)
TEH BUBUK ASHITABA HERBAL - TEH KESEHATAN,55000,80 gram,12.0,vikki96,90% (64 feedback)
Kertas Penyaring Kopi Paper Filter Coffee 50PCS Saringan Kopi Kantong Kosong Coffeebag Alat Penyeduh Kopi Saringan Teh PER-338,70400,350 gram,6.0,dudukmanisaja,100% (1389 feedback)
Teh Bawang Dayak Herbal Asli best Quality,58200,250 gram,12.0,pinksyafril,100% (331 feedback)
Jasmine Green Tea Ahmad Tea,48500,110 gram,5.0,ahmadteaindonesia,94% (69 feedback)
Tong Tji  Green Tea Teh Hijau 25 Tea Bag Teh Celup ,20000,120 gram,33.0,williamlukman,98% (1959 feedback)
Darjeeling Ahmad Tea,58200,110 gram,5.0,ahmadteaindonesia,94% (69 feedback)
Teh Celup Daun Insulin,15000,55 gram,15.0,amirah01,95% (1160 feedback)
Filter Saringan Infuser Teh Built-in Plunger - 16066 - Green,20600,30 gram,7.0,platinumplaza,98% (47963 feedback)
Teh 63 Jawa Oolong Natural,60000,100 gram,8.0,onlinetokoteh63,95% (111 feedback)
"teh celup cap GARDOE
50gr isi 25tea bag",8500,55 gram,22.0,kcankkcank,95% (2088 feedback)
TEH DANDELION HERBAL TEA PU GONG YING 300 G GR GRAM,46000,300 gram,7.0,kishen171116,100% (1706 feedback)
Fitne Slimming Tea - Teh Herbal,58000,85 gram,0.0,kacla_renra,100% (1945 feedback)
Sekuri Tea - Korean DDT & NDT Teh Pelangsing Herbal Detox Slimming Night Day Diet Tea Teatox Orihiro,95000,300 gram,0.0,sugeng_sarrono,88% (9 feedback)
MESIN Pres Tutup Gelas Cup Sealer & 40 Teh poci Capucino Jus Es Bubble & 41,765000,7.0 kilogram,1.0,indomesin3,91% (24 feedback)
Meja Kayu Jati Belanda Serbaguna ala Meja Teh Jepang Laptop Belajar Kerja Kopi Makan,360000,17.0 kilogram,0.0,rahmadhidayat01,100% (4 feedback)
teh hitam asli aroma melati termurah,7500,50 gram,0.0,dekaprasetyo,0% (0 feedback)
Teh Cap Botol Vintage Teh Celup Premium,55000,200 gram,18.0,susianzoes,100% (5 feedback)
Teh Celup Daun Kelor Berkualitas Premium isi 25 Teabags,85000,150 gram,2.0,liverpool1292,99% (150 feedback)
teh diet jiang zhi tea tiens pelangsing,140000,200 gram,0.0,wellymajesty,86% (118 feedback)
green tea-teh hijau pelangsing herbal-sliming tea-teh susut lemak pembersih detox dalam perut-lancarkan BAB Isi 25,38500,125 gram,4.0,hendry_malaikat13,99% (866 feedback)
teh sariwangi isi 25 bags,6000,50 gram,0.0,warungmakkunapah,100% (8 feedback)
teh sariwangi isi 25 bags,6000,50 gram,0.0,warungmakkunapah,100% (8 feedback)
teh tubruk sepeda balap 20gr,1500,20 gram,0.0,warungmakkunapah,100% (8 feedback)
Teh Meniran Songgolangit Obat Herbal Untuk Penyakit Asam Urat Batu Ginjal Hepatitis B Kuning Radang Sendi Hipertensi Penyakit Kulit,25000,200 gram,0.0,hamzahmulyanto,99% (273 feedback)
teh thermo--he rbalife-.herbal con  centrate-.,279000,300 gram,0.0,naningmarisah,98% (239 feedback)
Teh Mengkudu Obat Herbal Untuk Penyakit Kanker Tumor Demam Sakit Perut  Batuk Anti Peradangan Alergi Daya Tahan Tubuh,20000,200 gram,0.0,hamzahmulyanto,99% (273 feedback)
TEH SARANG SEMUT ASLI PAPUA OBAT HERBAL UNTUK BERBAGAI JENIS PENYAKIT OBAT MENURUNKAN KOLESTEROL,15000,50 gram,0.0,nidaherbalstore,58% (34 feedback)
Teh Seduh Cap NUTU Pekalongan,2000,60 gram,0.0,warungmakkunapah,100% (8 feedback)
teh tubruk cap poci 40gr,2500,40 gram,0.0,warungmakkunapah,100% (8 feedback)
Daduzi Teh Perut Buncit Original Jaco Herbal Slim Teh Pelangsing Isi 60 Sachet,470000,200 gram,0.0,sejahterajaya99,100% (3 feedback)
Kemasan 1 Kg - HARGA DISKON - Teh Herbal - Bunga Telang Kering - Clitoria TernaTea - Pewarna Makanan Alami - Teh Biru - Blue Tea,985500,3.8 kilogram,1.0,heruegalwan,100% (13 feedback)
Matcha Aik Cheong (Teh Hijau Pracampur) ,55000,350 gram,9.0,snacklicous,98% (1992 feedback)
Teh Hijau Green Tea Teh celup Kepala Djenggot 60 gram,11900,300 gram,5.0,houseofherb,98% (1001 feedback)
Cangkir & Tutup Seri 10 Ayam Jago Seri 2 - Mug Teh - Cangkir Kopi,27500,500 gram,10.0,168368,98% (1464 feedback)
Cangkir & Tutup Seri 11 Ayam Jago Seri 2 - Mug Teh - Cangkir Kopi,27500,600 gram,4.0,168368,98% (1464 feedback)
Heater Pemanas Air Teh Kopi Mini 12v 12 v volt 120w 120 watt di Mobil,50000,100 gram,17.0,uconalpukat,99% (508 feedback)
"Sayota SCG 178 Coffee Grinder / Penggilingan Kopi,Bumbu, Obat, Teh",185000,1.0 kilogram,5.0,kingshop18,100% (5571 feedback)
Teh Celup Curah Herbal DAUN KELOR Isi 20 Grosir Murah Berkualitas,6500,40 gram,40.0,indojuara,99% (266 feedback)
Max Tea Teh Tarik Tarikk,2500,150 gram,2.0,ricardo_crensius,96% (122 feedback)
BENALU TEH - HERBAL BENALU TEH MURNI KEMASAN 1KG,45000,1.0 kilogram,6.0,misbac532,100% (274 feedback)
Super Doll Sendok Teh,50000,600 gram,29.0,toni_arman,99% (342 feedback)
TEH MHS DAUN SIRIH MERAH TEH KESEHATAN,48000,150 gram,18.0,kingimport,91% (2521 feedback)
teh celup BIDARA,11500,100 gram,13.0,nabilaholshop123,99% (221 feedback)
Saringan Stainless Teh Kopi Buah 8 Cm,7000,30 gram,7.0,kitchenoutlet,94% (642 feedback)
Awet Muda dengan Original TPL Teh Peluntur Lemak Dijamin ASLI,125000,300 gram,4.0,sutrastore99,97% (4954 feedback)
Gelang Batu Akik Giok Teh HQ,85000,5 gram,7.0,joeking,96% (569 feedback)
promil teh almond sari kurma dan zuriat,72500,350 gram,9.0,tenkualmond,100% (138 feedback)
"Obat Diabet/Obat Diabetes/Obat Herbal Diabetes Daun Insulin,teh herbal diabetes daun,herbal diabetes daun yakon,celup herbal diabetes daun",8000,95 gram,22.0,azizahdzakira,100% (2159 feedback)
Body Slim Herbal Slimming Tea (BSH Tea) Original (Teh BSH),28000,185 gram,55.0,ahaushop,98% (4368 feedback)
THERMOMETER KOPI SUSU TEH BARISTA,40000,50 gram,4.0,laborato,100% (182 feedback)
Teh Putih Kiloan ,450000,500 gram,4.0,deny_ajaah,99% (253 feedback)
Teh Putih Kiloan 25 gram ,28000,100 gram,6.0,deny_ajaah,99% (253 feedback)
Teh Celup Sosro 30,5200,135 gram,2.0,williamsantoso,98% (1732 feedback)
Gelas Duralex Picardie Kopi Restoran Kafe Teh Bar 160ml 5.6oz,12600,200 gram,10.0,vankrawz,100% (269 feedback)
Sendok Takar Kopi 10gr  Sendok Ukur Teh 10gr,10500,10 gram,14.0,shiudewi,98% (579 feedback)
teh celup jati cina lam 88,9000,86 gram,26.0,nursito79,98% (2960 feedback)
Teh Naga Sachet 10 bungkus,15000,200 gram,39.0,dewifar,94% (223 feedback)
Gelas Duralex Picardie Kopi Restoran Kafe Teh Bar 220ml 7.75oz,16000,250 gram,37.0,vankrawz,100% (269 feedback)
Teh Gopek 80gr,5500,90 gram,35.0,ary_murdiyati,98% (2041 feedback)
"Obat Diabet/Obat Diabetes/Obat Herbal Diabetes Daun Insulin,Teh Herbal Diabetes Daun,Herbal Diabetes Daun Yakon,Celup Herbal Diabetes Daun",8000,95 gram,42.0,azizahdeni,100% (1840 feedback)
BIMA TEA SPOON RHINO SENDOK TEH RHINO LUSINAN RH003 DUS ABU POLOS,39000,350 gram,9.0,warung_vitato,98% (280 feedback)
Teh Gardoe jasmine tea natural dan wangi oleh khas solo 50 gr segar harum 25 teabags bunga melati,9000,100 gram,0.0,theeagles,98% (214 feedback)
Teko teh thai Teko teh tarik Teko stainlees ukuran 27cm,115000,1.55 kilogram,6.0,bayusinta,79% (113 feedback)
Obat Kuat   Teh Herbal Untuk Tahan Lama Pria Dewasa,149000,800 gram,0.0,fk_pomade,0% (0 feedback)
Teh Daun Kelor Premium Moringa isi 25 Teabags,85000,150 gram,0.0,liverpool1292,99% (150 feedback)
Teh Daun Jati Cina Berkualitas Premium isi 25 Teabags,85000,150 gram,0.0,liverpool1292,99% (150 feedback)
TEH CELUP SOSRO ISI 30 pcs,6000,100 gram,0.0,panca_priana,100% (436 feedback)
Teh Mahkota Dewa Alami  Original termurah,25000,500 gram,0.0,umi_choiriah340,0% (1 feedback)
Teh herbal pelangsing dan melancarkan haid ,10000,10 gram,,tokomsi_pasuruan,0% (1 feedback)
Natural Teh Persada - Agen Nasa Tanggerang,24000,200 gram,0.0,mohamad_budiarto,100% (6 feedback)
Teh Moringa Teh Daun Kelor isi 25 teabags Kualitas Premium,85000,150 gram,0.0,liverpool1292,99% (150 feedback)
teh sosro celup 15 tea bags,3500,20 gram,0.0,warungmakkunapah,100% (8 feedback)
Teh Daun Jati Cina Premium isi 25 Teabags,85000,150 gram,0.0,liverpool1292,99% (150 feedback)
Teh Daun Jati Cina Isi 25 teabags Kualitas Premium,85000,150 gram,0.0,liverpool1292,99% (150 feedback)
Teh Gurah agen nasa Ciledug Tangerang,75000,200 gram,0.0,agen_nasa_ciledug_tangerang,0% (0 feedback)
Ready Saringan Stainless Gagang Saringan Teh Saringan Minyak Serbaguna -Berkualitas,11000,50 gram,4.0,saritamunihar,75% (8 feedback)
Teh Daun Kelor Obat Herbal Untuk Penyakit Cacingan Gizi Untuk Ibu Menyusui Anemia Karena Haid Datang Bulan Menyehatkan Mata Anti Aging Anti Oksidan,20000,200 gram,0.0,hamzahmulyanto,99% (273 feedback)
teh celup sosro 30 tea bag,6000,60 gram,0.0,warungmakkunapah,100% (8 feedback)
Teh Mahkota Dewa Obat Herbal Untuk Penyakit Demam Berdarah DBD Lever Kuning Hepatitis Darah Tinggi Hipertensi Kencing Manis Diabet Diabetes Kegemukan,25000,250 gram,0.0,harunhamzah,99% (3623 feedback)
Teh Herbal Persada Nusantara-Teh Kesehatan Original Nasa,23000,350 gram,0.0,swalayan_nasa_bandung,0% (0 feedback)
Thermometer Termometer Susu Kopi Teh Daging Makanan Digital,28500,300 gram,0.0,tokothermometer,100% (1 feedback)
Teh cap gayung,3000,90 gram,69.0,haryono_adi2370,99% (226 feedback)
Thai Tea Green Tea Number One Brand Chatramue  Original BPOM Halal Teh Thailand,55000,200 gram,4.0,martadarson,100% (3663 feedback)
Tegreen 97 Suplemen Diet Teh Hijau 120 Vitamin Antioksidan Te Green - Teagreen,525000,100 gram,4.0,byme_olshop,98% (420 feedback)
Teh Celup Rosella Organik,8500,75 gram,17.0,akhdan_herbal,97% (20137 feedback)
Lemon Green Tea Ahmad Tea,48500,110 gram,6.0,ahmadteaindonesia,94% (69 feedback)
TEH GOPEK CELUP AMPLOP TBJA,9000,300 gram,16.0,kocky168,99% (1263 feedback)
Saringan Teh Stainless Steel Serbaguna Uk 20cm,18000,100 gram,3.0,geboyshop,96% (16133 feedback)
