title,price,weight,count_sold,seller,feedback_seller
Herbaleo Detox Tea - Teh untuk turun berat badan,80000,100 gram,5.0,herbaleo,99% (544 feedback)
FRENCH PRESS TEA COFFEE PLUNGER TEKO PENYARING TEH KOPI 350ML,57000,1.0 kilogram,5.0,goedangmoe,96% (461 feedback)
2Tang Vanilla Tea Teh Vanila 2 Tang Dua Tang Isi 25bag,6300,300 gram,8.0,dzworld,99% (13122 feedback)
Gelas Beer Jumbo 530 ml - Gelas Es Teh Jumbo,13000,650 gram,36.0,nad_love08,100% (1144 feedback)
Teh Daun Jati Cina  Hikmah,2500,60 gram,113.0,grosir_herbal_sinta,99% (115 feedback)
Tea Set Vicenza - Perlengkapan Minum Teh C78,325000,4.0 kilogram,9.0,yenitalie,87% (217 feedback)
Teh rosella Ungu Asli,18000,100 gram,5.0,gewjogja,98% (2191 feedback)
Filter Teabags - Kantong Saring Teh 8x12 Cm - Food Grade,600,2 gram,320.0,flonel,99% (725 feedback)
KURAMO TEH HERBA ORGANIK KUNYIT MAS,170000,200 gram,11.0,muhammad_irvandi,96% (1201 feedback)
Saringan teh tea filter teh rendaman teh celup wedang jahe herbal rendaman jamu  ramuan herbal murah ,30000,250 gram,6.0,tankiland_yogyakarta,99% (403 feedback)
Teh 63 - Oolong Tea Jasmine Import Teh Oolong Premium 100 Gram,99000,150 gram,6.0,tedi_sukses,99% (739 feedback)
Teh Celup Angkak,17000,55 gram,37.0,amirah01,95% (1160 feedback)
TEH ALAMI MEMBANTU MENGOBATI ASMA BRONKITIS MENGURANGI LEMAK NATURAL HU WANG TEA TEH PARA RAJA ORIGINAL NASA,75500,150 gram,8.0,widjaja185,99% (468 feedback)
Teh Daun Jati Cina Original Alami,2900,60 gram,25.0,regina100,98% (5629 feedback)
Teh Celup Herbal Manjaan (Manjakani),30000,100 gram,7.0,rumahrempahsolo,98% (1835 feedback)
COFFEE PLUNGER 3CUP FIORENZA / PENYARING KOPI / TEH,90000,850 gram,29.0,meiren,96% (15094 feedback)
BONICO THAI TEA Bubuk Minuman 500gr Ice Blend Milk Shake Smoothies drink powder TEH THAILAND,34000,540 gram,4.0,gitabali,98% (708 feedback)
Sabdo Singset Keraton Teh Diet Hijau Herbal By Roro Mendut,50000,65 gram,7.0,adyfashop,100% (175 feedback)
SANG JURAGAN TEH HELLA S HAASSE,47500,500 gram,6.0,pustakabukumurah,98% (792 feedback)
Bibit Parfum Green Tea Teh Hijau Fragrance Oil,1900,10 gram,236.0,leomh,96% (4722 feedback)
SANG JURAGAN TEH,39000,400 gram,9.0,afpgramadia,96% (1166 feedback)
sedotan bubble teh set.,62500,160 gram,3.0,syamsudin_martina,99% (1153 feedback)
sedotan bubble teh set 4&2&1,70000,165 gram,3.0,syamsudin_martina,99% (1153 feedback)
Grosir Teapot 1250 ml  Teko kaca ceret tempat teh saringan stainless tea pot Keren,55400,650 gram,0.0,jackma894,100% (22 feedback)
Blesstea Bless Tea Teh Hitam Kemasan Botol isi 110 Gram,125000,150 gram,0.0,liverpool1292,99% (150 feedback)
Grosir Saringan Thai Tea  Saringan Kain  Alat Saring Kopi Susu Teh Tarik Keren,23400,100 gram,0.0,jackma894,100% (22 feedback)
Gayung Air  Teh tarik Gayung Teh thai Gayung Kopi aceh Gayung Stainlees,42000,500 gram,2.0,bayusinta,79% (113 feedback)
Daduzi Teh Perut Buncit Original Jaco Teh Detox Teh Pelangsing Isi 15 Sachet,120000,100 gram,1.0,sejahterajaya99,100% (3 feedback)
TEH WANGI-TEH KEMASAN EKONOMIS-TEH CANDI WAYANG-TEA PRODUK LAWANG-MALANG-TEH 1 PACK ISI 50 SACHET,10000,160 gram,208.0,achmadridwan149,100% (3221 feedback)
Teh Cap Napen 1 Pack isi 10 Bungkus 40gram Teh Tubruk Bunga Melati,18000,500 gram,0.0,pawon_store,96% (277 feedback)
Teh Blackcurrant tea kepala djenggot gardoe solo 12 teabags 30 gr the merah segar nikmat minuman ,14500,100 gram,1.0,superbeagle,98% (2214 feedback)
Natural Tea - Teh Celup Hitam - Agen Nasa Tanggerang,32000,200 gram,0.0,mohamad_budiarto,100% (6 feedback)
Denpoo thermos pemanas air untuk seduh kopi teh dan minuman lainnya,415000,6.0 kilogram,0.0,tinghendra,100% (2 feedback)
