title,price,weight,count_sold,seller,feedback_seller
teh jiang zhi tea - pelangsing badan - penghancur lemak - asam urat - original,150000,60 gram,1.0,fridho_handayana,98% (63 feedback)
Bioslim Herbal Mixture Teh Pelangsing & Melancarkan Buang Air Besar,135000,170 gram,2.0,darren_zhang,99% (7068 feedback)
Isi 50 butir Benih biji bunga telang butterfly pea untuk teh kesehatan dan pewarna makanan,45000,30 gram,7.0,cabehias,100% (1546 feedback)
Teh tarik bubuk 500 gr-Teh tarik-Teh tarik cocok untuk Cafe dan Restaurant-Teh tarik cocok untuk Hotel,37500,500 gram,0.0,parlindungan_simbolon519,100% (1 feedback)
HERBAL ALAMI TEH DAUN JATI CINA OBAT PELANGSING AMPUH ASLI,10000,50 gram,0.0,herbaloriginal88,100% (794 feedback)
Teh Celup Herbal Jati Cina Senna Folium Darusyifa Pelangsing ,13000,100 gram,0.0,syukmabook,100% (2055 feedback)
Teh Hijau Green tea activa Pelangsing Badan Alami,40000,50 gram,0.0,nabawiherba,100% (491 feedback)
original teh celup herbal kulit manggis darusyifa laris,15500,100 gram,0.0,olivia_salsa_bila,100% (1582 feedback)
Teh Hitam Mujarobat Obat Diabetes Kolesterol Darah Tinggi dan Rendah,17000,60 gram,0.0,mujarobatt,98% (62 feedback)
Masker Wajah Nature Republic Real Nature Mask Sheet Varian Teh Hijau Green Tea Original Import Terlaris,16000,30 gram,129.0,lusi_rahmawati_neneng,100% (418 feedback)
Gelas Kertas Foam Paper Cup 8oz Motif Hot Coffe Kopi Teh Panas TANPA TUTUP,18000,300 gram,19.0,distoreku,94% (3633 feedback)
Teh Daun Tin Kering Oven 1kg kualitas standard ,100000,1.0 kilogram,8.0,salfin,98% (284 feedback)
ASI Booster Tea / Teh penambah ASI,75000,500 gram,20.0,anakkinbabystore,93% (6289 feedback)
Frestea Apel Apple teh minuman 350mL all var,5000,500 gram,6.0,ricardo_crensius,96% (122 feedback)
Teh Asiku TN57 - Teh Celup Daun Katuk - ASI Booster Tea - Teh Ibu Menyusui,14500,100 gram,37.0,tokopribumi,99% (3889 feedback)
Teh 999,6000,95 gram,31.0,ary_murdiyati,98% (2041 feedback)
herbal mengobati darah tinggi dengan teh daun salam alami tanpa efek samping berkualitas,22000,80 gram,13.0,joko_ardiansyah205,100% (41 feedback)
Teh Celup Rolas Original,7000,100 gram,44.0,distributorteh,100% (1213 feedback)
Teh Hijau Kepala Djenggot Ekonomis,5400,80 gram,54.0,mejikushop9,98% (1421 feedback)
TEKO KOPI DAN TEH PLUS SARINGAN,120000,1.0 kilogram,29.0,qupret_herry,98% (1290 feedback)
Teh Herbal Murbei,25000,125 gram,52.0,distributorteh,100% (1213 feedback)
Teh Celup Daun Jati Cina Laurico,22000,102 gram,26.0,reddyasien,99% (12067 feedback)
Teh Celup Herbal Daun Kelor Tazakka,15500,100 gram,23.0,gummystore,99% (4198 feedback)
TEH HIJAU CAP JENGGOT REBUS. PELURUH KOLESTEROL & LEMAK,14700,150 gram,11.0,omahjamuonline,99% (23553 feedback)
PLASTIK ES BENTUK  TEH BOTOL ISI 100PC,19500,450 gram,49.0,plastikbuahwahana,96% (555 feedback)
Tjatoet Teh Hitam Celup Black tea Tatut isi 25bag,5200,300 gram,12.0,dzworld,99% (13122 feedback)
Teh Celup Sarang Semut Asli,8500,100 gram,42.0,akhdan_herbal,97% (20137 feedback)
Plastik Klip Berdiri Uk 9 x 15 cm 125 ml - Standing Pouch Khusus Cairan - liquid grade minuman sirup jus capucino lemon teh soda kopi air water dll,60000,280 gram,11.0,geraifarzana,99% (868 feedback)
10ml - Green Tea Essential ( Minyak Teh Hijau) 100% Pure,101500,30 gram,8.0,sukoaromaline,99% (468 feedback)
Wedang Teh Rosella Rosela Gula Batu,1700,26 gram,72.0,i99,97% (208 feedback)
Teh Celup Daun Sukun Gholiban,11000,90 gram,75.0,sauudahherbal,89% (1062 feedback)
Lipton Ice Tea Lemon 625gr Lipton Tea ice lemon minuman teh jeruk lemon,43000,750 gram,16.0,kingimport,91% (2521 feedback)
Teh Pucuk Harum 250ml isi 24 botol,53000,2.5 kilogram,3.0,winspandashop,99% (2882 feedback)
Teh Pradjurit 40 gram SOLO,3200,80 gram,10.0,williamsantoso,98% (1732 feedback)
Teh tokin tea teh masuk angin sakit kepala,31000,120 gram,7.0,bintang010206,98% (3766 feedback)
"Paket Liang Teh Komplit (liang teh, 2 buah lo han kuo, gula batu)",45000,800 gram,12.0,healthy_herbal,99% (2655 feedback)
BA KUT TEH /BAKUT TEH,30000,100 gram,13.0,healthy_herbal,99% (2655 feedback)
LOHANKUO ZHENZHU SHESHECAO TEH LOHANKO,21000,225 gram,30.0,edyaciu,99% (4864 feedback)
TEH CELUP KAYU SANREGO TEH INI SANGAT KAYA MANFAAT,28000,100 gram,22.0,adrian_musyafi,98% (2046 feedback)
"teh jati cina,teh celup jati cina kencono sari,diet alami.",15000,100 gram,24.0,kiosherbalsinta,99% (2990 feedback)
solusi prut buncit huwang tea teh herbal alami nasa ,80000,250 gram,0.0,siti_muslihah242,97% (119 feedback)
gelas mug stainless steel - mug kopi atau teh - termos mug - vacuum cup 500 ml ,28100,400 gram,11.0,fello1989,98% (2713 feedback)
Daun Benalu Teh Hijau Buah Mahkota Dewa Salama Nusantara Tanpa Efek,17000,180 gram,38.0,syukmabook,100% (2055 feedback)
KOPI HIJAU MUSAFIR Rasa Teh Hijau Campuran Nikmat Penuh Khasiat,45000,112 gram,0.0,kotamera,99% (8182 feedback)
CENTELLA TEA ISI 12 TEH DAYA INGAT ANTIPIKUN IPB SERAMBI BOTANI HEALTHY & NATURAL PRODUCTS,28500,12 gram,3.0,bogoridstore,100% (426 feedback)
Teh Hijau Cap Gunung CV Pasajar Seduh 75gr,15000,100 gram,0.0,herbaltum,88% (1010 feedback)
Teh Bunga Forget Me Not n- Myosotis Flower  30 Gr,30000,150 gram,0.0,vinsensialili,97% (45 feedback)
Teh celup Jati Cina -Teh Daun Jati Cina isi 20 sachet - Melangsingkan Tubuh,15000,15 gram,0.0,herbaltum,88% (1010 feedback)
Teh Bunga Telang 1 kg Butterfly Pea Flower Tea,770000,1.0 kilogram,0.0,ailailzyana,100% (7779 feedback)
Teh celup daun sukun Gholiban,16000,150 gram,59.0,herbalmurah14,98% (5423 feedback)
Everslim Tea - Ever Slim Tea By EverWhite - Teh Pelangsing - ORIGINAL - Teh Pelangsing Ever White - Pelangsing,75000,200 gram,0.0,rizzaccesories,97% (393 feedback)
KEMASAN KANTONG TEH per kilo - kemasan kopi bubuk - silver,17500,200 gram,0.0,perlengkapanice,98% (64 feedback)
gelas mug stainless steel - mug kopi atau teh - termos mug - vacuum cup 500 ml ,28100,400 gram,11.0,fello1989,98% (2713 feedback)
Cangkir Penghangat Pemanas Air Teh Kopi Hangat Panas Heater Mobil 12v,129000,300 gram,4.0,santa86,100% (8872 feedback)
TEH DAUN CINA ORIGINAL - HERBAL ORGANIC TEA -TEH PELANGSING - TEH PELUNTUR LEMAK,5000,40 gram,4.0,kelontongofficial,100% (145 feedback)
Herbal HIU Benalu Teh Perawatan dan Mencegah kanker ,40000,80 gram,0.0,herbaltum,88% (1010 feedback)
Teh Serbuk Herbal Jamblang - Duwet - Juwet 4 in 1 Daun - Buah - Biji - Kulit,99900,45 gram,8.0,nmqueennov,100% (12 feedback)
Sarang Semut asli Papua. Teh Herbal Alami Asli Papua. Kemasan 100 gr. ,16800,250 gram,0.0,roni_aburasyad,100% (155 feedback)
Liza Herbal Salam Green Tea Plus - Teh Herbal Untuk Kolesterol,30000,100 gram,0.0,erdayeni,98% (72 feedback)
ORIGINAL NASA TEH KESEHATAN DAN KOLESTROL HERBAL HU WHANG TEA NASA HERBAL NASA,68000,50 gram,0.0,penjualan_produk_nasa,100% (814 feedback)
Saringan kain bahan blacu untuk kopi teh ukuran 28 x 35 cm TOP,39000,500 gram,6.0,galericantik,100% (3984 feedback)
Teh Celup Daun Jati Cina,8800,75 gram,333.0,afanigrosir,98% (16039 feedback)
Teh Pucuk Harum 250ml isi 24 botol,53000,2.5 kilogram,3.0,winspandashop,99% (2882 feedback)
Teh curah daun jati cina HIKMAH HERBAL original,4500,60 gram,29.0,candra_herbal83,99% (2125 feedback)
Teh tokin tea teh masuk angin sakit kepala,31000,120 gram,7.0,bintang010206,98% (3766 feedback)
Teh Pucuk Harum 350 ml Isi 24 Pcs - 1 Dus,54000,9.0 kilogram,7.0,popboxstore,88% (652 feedback)
HARGA 1PCS Sendok Teh STG Plastik Bening Transparan Pudding Yoghurt Cake Ice es Cream Krim,100,2 gram,459.0,distoreku,94% (3633 feedback)
Termurah Chamomile Flower Tea Teh Bunga Chamomile Yunani - 100Gr,500000,160 gram,45.0,riastini_mando,99% (106 feedback)
PD019 SENDOK MOTIF BUNGA SILVER STENLIS STAINLESS STEEL SENDOK TEH KUE KOPI CAKE SPOON,10900,85 gram,24.0,ahokistore,94% (5478 feedback)
PD018 SENDOK KARAKTER STENLIS STAINLESS STEEL SENDOK TEH SENDOK KUE HK DORAEMON,10900,85 gram,23.0,ahokistore,94% (5478 feedback)
Teh Benalu 500 gram ASLI Tanpa Campuran - Obat Kanker Dll Herbal LA,65000,650 gram,8.0,ricardo_frannico,100% (2465 feedback)
Paket Kopi Gula Teh,18000,700 gram,3.0,yurom,100% (17469 feedback)
Astonish tea & Coffee Stain remover penghilang noda teh & kopi,69900,650 gram,16.0,qaishar,98% (1839 feedback)
Teh mahkota dewa Salama Nusantara,20000,180 gram,47.0,gummystore,99% (4198 feedback)
Bubuk Minuman BONICO THAI TEA 250gr Ice Blend Milk Shake Smoothies drink powder teh Thailand tarik,20000,280 gram,9.0,innovasi,96% (311 feedback)
Teh Pegagan. jasarama,20400,100 gram,20.0,herbamartherbals1,100% (267 feedback)
Teh Celup Daun Sirsak,10500,100 gram,96.0,yeyeherbal,100% (15202 feedback)
Blesstea teh hitam pelangsing,120000,400 gram,7.0,aton899,96% (2131 feedback)
Teh Poci Golag Gold 9gr teh slawi tegal,10000,50 gram,28.0,kisthea,100% (8521 feedback)
Teh bidara murni harum 1 kg,50000,1.2 kilogram,5.0,arjun_rempal,98% (1502 feedback)
KG003 Electric Warmer Penghangat Minuman Kopi Teh Susu Pemanas,89000,300 gram,4.0,dipilih_dipilih,99% (329 feedback)
Herbs Tea - Teh Kembang Telang - Dried Butterfly Pea - Blue Tea,9000,50 gram,10.0,mettamilk,100% (1562 feedback)
TEH CHRYSANTHEMUM 100G 100GR 100GRAM 100 G GR GRAM ,27000,130 gram,7.0,kishen171116,100% (1706 feedback)
Gelas Keramik Hias Pasangan - Mug Couple Unik dan Lucu Model Jaket Untuk Kopi atau Teh - Cangkir Kado Pernikahan,49000,700 gram,5.0,idbenowo,99% (310 feedback)
teh serai etam BALIKPAPAN,25000,200 gram,21.0,widhi2735,100% (204 feedback)
Saringan Stainles 8 cm jus buah teh kopi ayakan,13000,100 gram,7.0,maria_maria314,98% (2015 feedback)
Teh Celup Sarang Semut Papua,11500,80 gram,51.0,afanigrosir,98% (16039 feedback)
Marufuji Sencha Green Tea Teh Hijau Jepang,75000,200 gram,10.0,1stop4all,93% (1287 feedback)
TWININGS TEA of London - Pure White Tea - Teh Impor,112000,230 gram,7.0,tokomartshop,100% (712 feedback)
JUMBO French Press 1L Pembuat Kopi Teh UPPHETTA Saringan Coffee,135000,1.3 kilogram,3.0,rrhomedesign,99% (1405 feedback)
Teh celup daun jati Cina - china pelangsing alami BPOM ORIGINAL,31300,80 gram,0.0,imam_setiawan638,100% (63 feedback)
Teh Celup Daun Sirsak Izin Dinkes - UD Raya Kudus - Teh Herbal,16300,100 gram,0.0,sadeyanbukucom_sadeyanbukucom,100% (8805 feedback)
Teh Celup Hitam Black Tea GOALPARA 30 Tea Bags,7000,85 gram,0.0,syukmabook,100% (2055 feedback)
Teh Hijau Cap Gunung CV Pasajar Seduh 75gr,15000,100 gram,0.0,herbaltum,88% (1010 feedback)
teh j sella teh pelangsing bervitamin c dosis tinggi,20000,250 gram,0.0,winacollection22,99% (1036 feedback)
Minuman kesehatan teh hijau sehat langsing diet alami,750000,400 gram,0.0,twomonth,92% (98 feedback)
Teko Ceret Tempat air  Teh Kopi Stainless Ultralight Dengan Filter 10 Cm  500ml - JAG GEAR,100000,475 gram,2.0,adi_setyo_nugroho,93% (709 feedback)
tea herbulgari alami herbal teh herbal alami ampuh untuk memperlancarkan peredaran darah rematik syaraf kejepit dll 1pack isi 10sachet bukan tiens,240000,100 gram,7.0,mutiara6herbal,99% (6905 feedback)
Teh Gurah Nasa-Teh yang bisa mengeluarkan lendir yang kotor-Ampas nya bisa buat masker-Agen Nasa Bandung Cicaheum,70000,50 gram,0.0,geral_parkesit_bungsu,100% (27 feedback)
MURAH Teh Celup Binahong -Gholiban-  Teh Celup Kemasan isi 20 tea bag,15000,50 gram,0.0,herbaltum,88% (1010 feedback)
"Teh, Sejarah dan Tradisi, Cara Benar Menyeduh dan Menikmati, Khasiat - Murdjiati Gardjito, Dimas Rahadian",44900,260 gram,5.0,bukubeta,100% (65001 feedback)
Teh Celup Binahong Tazakka - isi 20 - Teh Binahong Herbal Penyembuhan Luka,15000,80 gram,0.0,herbaltum,88% (1010 feedback)
Teh Celup Hitam Black Tea GOALPARA 30 Tea Bags,7000,85 gram,0.0,syukmabook,100% (2055 feedback)
Jual 20 gram Teh Bunga Telang Organik Thailand Butterfly Pea Flower Tea,22900,20 gram,9.0,ailailzyana,100% (7779 feedback)
SPECIAL PROMO. Teh Celup Torbangun. Organik. Pelancar ASI Terbaik. 20 x 2 gram.,32500,50 gram,0.0,aafiyahstore,100% (6 feedback)
Teh Herbal - Bunga Telang Kering - DISKON - Clitoria TernaTea - Pewarna makanan alami - Teh Biru - Blue Tea,13900,35 gram,16.0,heruegalwan,100% (13 feedback)
Glori Melamine Cangkir Minum Sedang 250ml Melamin G974ORG Cangkir Kopi & Teh - Orange,28000,200 gram,3.0,glorimelamine,95% (6964 feedback)
MURAH KOMPOR THAI TEA Tungku TEH TARIK THAILAND SUSU JAHE ANGKRINGAN .,685000,7.0 kilogram,0.0,indomesin3,91% (23 feedback)
ORIGINAL Teh Celup - Teh Daun Sukun Gholiban Kesehatan Jantung,15000,100 gram,0.0,herbaltum,88% (1010 feedback)
teh sella lokal teh pelangsing bervitamin c dosis tinggi sebagai anti oksiidan,20000,250 gram,0.0,winacollection22,99% (1036 feedback)
Paket Obat Teh Pelangsing Tubuh Badan Seven Slim Kapsul & Teh Herbal Alami Aman BPOM Asli Original Murah,142000,300 gram,70.0,beautilo,100% (3031 feedback)
Teh Celup Kayu Sanrego,29000,100 gram,15.0,herbalwahana0101,99% (4959 feedback)
Mama Bear Mamabear Teh Pelancar Asi Booster Tea Milkymama Cookies herbs of gold blackmores,37800,200 gram,34.0,secrethealthshop,96% (2099 feedback)
Teh Teki mengatasi lemak tubuh dan keputihan ampuh  mencegah kanker,75000,2 gram,12.0,rioedo28bbk,93% (32 feedback)
daun teh boh cameron highlands tea 250g,58000,350 gram,14.0,h417di,95% (1374 feedback)
Teh Celup Daun Jati Cina Alami,9000,100 gram,11.0,herbamart76,95% (8492 feedback)
Teh Mawar,15000,50 gram,10.0,kedaisehat01,94% (2943 feedback)
sendok teh panjang,1700,50 gram,3.0,albaqi_olshop,99% (508 feedback)
Teh jati cina-teh herbal-kesehatan-penurun berat badan-obat diet,8000,60 gram,12.0,rumahherbal999,96% (51 feedback)
Teh Celup Sarang Semut Kencono Sari,13000,250 gram,11.0,herbalsahi,98% (2009 feedback)
Gelas Plastic Thai Tea Cup 22 0z PP Plastik Teh Thailand Tinggi Tebal,600,20 gram,2246.0,distoreku,94% (3633 feedback)
Teh Wangi Cap Buah Soklat,3500,60 gram,367.0,williamsantoso,98% (1732 feedback)
Teh Djumput extra harum 40 gram,2700,70 gram,17.0,williamsantoso,98% (1732 feedback)
Teh Goalpara Bubuk 100gr,6500,150 gram,22.0,williamsantoso,98% (1732 feedback)
Teh Hitam Gambyong Kemuning,14000,300 gram,18.0,williamsantoso,98% (1732 feedback)
Gelas Duralex Picardie Kopi Restoran Kafe Teh Bar 90ml 3.125oz,12000,200 gram,12.0,vankrawz,100% (269 feedback)
TEH DADUZI ORIGINAL JAKO TEH PELANGSING,380000,200 gram,7.0,slamet_riady135,100% (125 feedback)
Sendok Teh elegant 1 Pack isi 6 pcs,27500,200 gram,31.0,niaga_baru,98% (6008 feedback)
Teh songgolangit darusyifa atau teh celup asam urat,12000,90 gram,56.0,lenteng_herbal_store,98% (2320 feedback)
"Teh Daun Jati Cina Original Alami Herbal Organik Teh Pelangsing
",5900,80 gram,12.0,shintadevitalestary,95% (5657 feedback)
Tan Ngan Lo Medicated Tea - Ubat Akar Akar Teh Sejuk Cap Tan Ngan Lo,66500,135 gram,8.0,mandjur,99% (40223 feedback)
Promo Teh Hitam 3 refill pack 80 gr  ,210000,400 gram,5.0,ktarina,99% (218 feedback)
Teh bunga chrysanthemum,21000,50 gram,12.0,veganindonesia,97% (722 feedback)
Teh Celup Herbal Rosella Ungu,15000,80 gram,9.0,muliashop,96% (7024 feedback)
PAKET 90 HARI - ELMINA PLATINUM SUPER DETOX TEA - TEH PELANGSING - TEH KESEHATAN,375000,1.0 kilogram,5.0,elmina_official,99% (167 feedback)
Teh Bunga ROSELLA ungu 100 gram Teh ROSELA ungu  rebus curah,15500,200 gram,13.0,khc2,99% (712 feedback)
Saringan Teh almunium vintage jadul ,5000,30 gram,19.0,nabhawi,99% (588 feedback)
Bubuk Minuman Rasa Teh Thai Tea Mix Gula - JPS Drink Powder 1 kg,55000,1.1 kilogram,5.0,tokotuku_id,99% (5585 feedback)
Purwaceng Purwoceng Teh Organic Ramuan Obat Kuat Herbal Alami berisi 15 bags sachet,50000,110 gram,6.0,rumputkebarpapuaasli,98% (237 feedback)
Paket Teko Thai Tea Saringan Thai Tea Teh Tarik Kopi 24 Cm,90000,1.7 kilogram,29.0,meiren,96% (15094 feedback)
MURAH Teh Celup Pegagan Stimulan -Teh Pegagan Gholiban- penurun panas,15000,80 gram,0.0,herbaltum,88% (1010 feedback)
Obat Lever nyeri pada tekapak kaki  sering kesemutan dll Teh Hitam Mujarobat solusinya,17000,60 gram,6.0,mujarobatt,98% (62 feedback)
Mug Keramik Dong Hwa Mug Kopi & Teh warna Pastel 300ml bagus berkualitas,39000,500 gram,1.0,donghwaindonesia,98% (129 feedback)
Teh Daun sirsak teh celup herbal 1box isi 20 teh celup,40000,50 gram,0.0,jerry731,85% (21 feedback)
Mug Keramik Dong Hwa Mug Kopi & Teh 350ml warna pastel bagus berkualitas,39000,500 gram,2.0,donghwaindonesia,98% (129 feedback)
Sendok Teh Karakter / Sendok Bayi / Sendok Gula Mini,5500,25 gram,140.0,ladangbaju,98% (9680 feedback)
Teh Hijau Green Tea cap Kepala Djenggot Jenggot Pemium 25 Sachet Penghargaan SNI,12500,140 gram,60.0,syukmabook,100% (2055 feedback)
Teh Sanna Al Sunnah 27 Sachet Pelangsing Pencuci Perut Slimming Tea Terbaik Malaysia,37000,110 gram,34.0,syukmabook,100% (2055 feedback)
Glori Cangkir Minum Sedang 250ml Melamin G974PTH Cangkir Kopi & Teh - Putih,28000,200 gram,0.0,glorimelamine,95% (6964 feedback)
Dong Hwa Korean Tea Set 9Pcs Ceramic Poppy Flower Set Teh Korea Keramik Teko Gelas Piring,450000,1.0 kilogram,0.0,donghwaindonesia,98% (129 feedback)
Glori Cangkir Minum Sedang 300ml Melamin G975MRH Cangkir Kopi & Teh  - Merah,36000,200 gram,0.0,glorimelamine,95% (6964 feedback)
TEH DADUZI ORIGINAL JACO 1 BOX ISI 30 SACHET MINUMAN PELANGSING DETOK.,380000,200 gram,0.0,violin98,99% (628 feedback)
Fat yan tea original bpom teh dewi-teh minuman diet pelangsing alami isi 40teabags setara teh tiens ,110000,300 gram,0.0,garuda789,99% (1770 feedback)
Glori Cangkir Minum Sedang 300ml Melamin G975ORG Cangkir Kopi & Teh - Orange,36000,200 gram,0.0,glorimelamine,95% (6964 feedback)
TEH 4 in 1 HERBAL DUWET-JAMBLANG-JUWET - Buah&Biji&Daun&Kulit -  Kemasan Pouch,56700,25 gram,5.0,nmqueennov,100% (12 feedback)
Teh Herbal Collaskin drink Original,200000,300 gram,0.0,nasastockisbwi,0% (0 feedback)
Purwaceng Teh Dieng Purba,61800,125 gram,0.0,calya_chesta,0% (0 feedback)
Teh Pelangsing Peluntur Lemak Penurun Berat Badan Alami Paling Ampuh Aman Cepat BSH Body Slim Herbal,67000,100 gram,0.0,naturalbeautycare,100% (563 feedback)
TEH PINTAR - TEH ANTI PIKUN - TEH NUTRISI OTAK TEH PEGAGAN HEALTHY & NATURAL PROODUCTS,36000,100 gram,10.0,serambibotaniofficial,100% (290 feedback)
Glori Cangkir Minum Sedang 300ml Melamin G975HJU Cangkir Kopi & Teh - Hijau,36000,200 gram,0.0,glorimelamine,95% (6964 feedback)
Kantong Plastik Pop Ice Teh Poci Bubble Tea isi 2 cup,4000,100 gram,221.0,sese,96% (4638 feedback)
Sendok Es Teh SS - Polos ,32500,300 gram,7.0,diza_shop,100% (299 feedback)
Teh Pelangsing Sinensa Sinensa Green Tea Herbal,25000,100 gram,18.0,beautycenterindonesia,99% (50218 feedback)
Sendok Kecil Teh / Kopi  FO-861,9000,250 gram,36.0,agungjaya_mas,98% (1799 feedback)
Teh Pucuk 350ml,54000,4.0 kilogram,8.0,menususiani,96% (1177 feedback)
Teh roibos,95000,300 gram,7.0,agung_margono987,100% (107 feedback)
Teh Kulit Manggis Darusyifa Alami,10000,100 gram,26.0,amanahherbal,99% (2604 feedback)
teh GOPEK Hijau Besar (HB),30000,600 gram,13.0,tehgopekbdg,100% (78 feedback)
Meises Elmer Warna Hijau Tua Rasa Green Tea Matcha Teh Hijau Repack 100 Gr - Halal MUI BPOM Chocorice Choco Rice Chocolate Meses Mesis Mises Topping,9500,130 gram,12.0,gameela,88% (6385 feedback)
Teh daun jati cina jati cina teh langsing obat langsing,10000,120 gram,174.0,bestseeds,100% (152 feedback)
Latina STA-3301 Milk Frother - Pengaduk Pembuih Busa Susu - Kopi - Teh,32000,109 gram,15.0,puserba,99% (13937 feedback)
berat 500 g gr gram Teh daun Benalu kering ji sheng cha ASLI Tanpa Campuran,33000,600 gram,11.0,kishen171116,100% (1706 feedback)
Teh Hitam Rasa Vanilla,5500,90 gram,11.0,superkaya,99% (1713 feedback)
teh CELUP daun SIRSAK isi 20 kantong DARUSYIFA,9000,100 gram,28.0,fast_delivery,95% (3203 feedback)
Kemasan Gusset Metalized untuk Bag Teh Celup,400,3 gram,2603.0,kemasan1001,99% (345 feedback)
Teh Daun Bidara Rehab Hati,27000,125 gram,48.0,abu_rayyan04,100% (71 feedback)
Jamu Teh Hitam Mujarobat,17000,5 gram,68.0,brata_sena,71% (28 feedback)
Teh Hijau Thailand - Green Tea Chatramue 200 gram HALAL,55000,200 gram,17.0,cheapstore898,99% (909 feedback)
Japanese Green Tea Sencha Teh Jepang Bubuk Uji No Tsuyu Sen-Cha,85000,250 gram,12.0,1stop4all,93% (1287 feedback)
Teh krisan (Tea Chrysanthemum),65000,300 gram,9.0,efri_ktk,97% (177 feedback)
MAMA ASIX Teh Pelancar Lancar Asi Booster Tea Mama Asix Teh Kantong,119900,250 gram,3.0,smartgreenmommy,99% (600 feedback)
Teh Serbuk Hitam Kaligua 100 gram,7900,100 gram,40.0,anymousaja,97% (4203 feedback)
Fat Yan Tea / Teh Dewi Kuan Yin. Teh Pelangsing Herbal China,100000,200 gram,9.0,semuaherbal,95% (406 feedback)
TEH CELUP JATI CINA DARUSYIFA JATI CHINA,10000,100 gram,21.0,nursito79,98% (2960 feedback)
Teh Curah Daun Sirsak Bin Rais - Obat Kanker - Tumor - Hernia - dll,3200,50 gram,24.0,lenteng_herbal_store,98% (2320 feedback)
Mug Cangkir Gelas Stainless Mini Kopi Teh Kecil 8 cm,8900,250 gram,6.0,tasikjaya,94% (4714 feedback)
Teh Herbal - Teh Celup Daun Kelor - 20 Bag,17000,80 gram,7.0,fatimah_herbal,96% (2143 feedback)
Sendok takar kopi  coffee spoon  sendok teh stainless  tea spoon,42000,25 gram,6.0,kdedi501,99% (1067 feedback)
Super Doll Sendok Teh (SKU:00142.00014),18500,160 gram,8.0,leoonline,91% (1764 feedback)
TEH HITAM 100% ASLI PASIR WALIK YOGYAKARTA,11000,110 gram,62.0,pasir_walik,99% (608 feedback)
teh pembakar lemak--he rbalife-.,279000,300 gram,0.0,naningmarisah,98% (239 feedback)
Dong Hwa Korean Tea Set 9Pcs Ceramik Red Rose Set Teh Korea Keramik Teko Gelas Piring,450000,500 gram,0.0,donghwaindonesia,98% (129 feedback)
SO SHIN II 2 MGI.MCI -Pelangsing teh kopi hijau lemon green tea coffee,29000,40 gram,7.0,okychan,80% (5 feedback)
Glori Cangkir Minum Sedang 250ml Melamin G974HJU Cangkir Kopi & Teh - Hijau,28000,200 gram,0.0,glorimelamine,95% (6964 feedback)
teh seduh daun insulin-daun yakon ampuh mengatasi diabetes-menurunkan kadar gula dlm darah-liver-sakit tenggorokan ,20000,100 gram,6.0,denny_chau,100% (2252 feedback)
Teh Perut Buncit Daduzi Original Asli JACO Herbal Slim Teh Pelangsing Isi 30 Sachet,233000,200 gram,2.0,sejahterajaya99,100% (3 feedback)
sliming herb-sliming herb tea-sliming herbal-teh pelangsing alami-teh peluntur lemak anti detox-pelangsing herbal teh,100000,250 gram,0.0,hendrymalaikat13,99% (1472 feedback)
Bibit Bunga Rosela Merah - Pohon RosellaTanaman Obat Herbal Teh Hibiscus Sabdariffa,21000,400 gram,5.0,ciptalestariherb,98% (891 feedback)
BERKUALITAS Teh Celup Manjakani Plus Kacip Fatimah Darusyifa DISCON,24000,100 gram,0.0,nidaherbalstore,58% (34 feedback)
Mercolade Rainbow Compound Eceran - Rasa Green Tea - Warna Hijau Teh - Netto 165 Gr - Halal MUI - Hasil Olah Gula Berasa Aneka Coklat Olahan Batangan Warna-warni ,13200,185 gram,109.0,gameela,88% (6385 feedback)
Teh Herbal Daun Jati Cina -  Teh Pencuci Lemak Isi 20 tea celup ,36000,100 gram,0.0,cantikherbal97,100% (3931 feedback)
Hindi slimming tea jaminan asli...teh diet pelangsing alami peluntur lemak isi 25 teabags bukan leptin 1000,125000,200 gram,0.0,garuda789,99% (1770 feedback)
Teh Celup Daun jati Cina Diet Nusadrink Herbal Pelangsing Alami anti Gemuk,7500,25 gram,0.0,toracyber,100% (107 feedback)
fat yan tea atau teh dewi-minuman diet pelangsing alami isi 40teabags original bpom,110000,250 gram,0.0,hengki_sung,99% (113 feedback)
Teh Daun Jati Cina - Teh Herbal Pelangsing Alami - Menyusutkan Perut - Menghancurkan Lemak Tubuh - Memperbaiki Pencernaan,6500,61 gram,3.0,rukoherbal,100% (1286 feedback)
Tiens Jiang Zhi Tea - Teh Hijau Tianshi Ori Pelangsing Herbal - Penghancur Lemak - Asam Urat - 1 Box isi 40 Sachet,315000,100 gram,630.0,warungsehaat,98% (1089 feedback)
teh dewi fat yan tea original bpom..teh minuman diet pelangsing detox alami,110000,300 gram,0.0,santoso_wijaya142,99% (993 feedback)
K Mu Ri Ca Ta TEh Penghancur sel kanker sel tumor dan sel hiv 1 box isi 30 sachet Original,450000,500 gram,0.0,kenzmedika2100,100% (9 feedback)
Teh Celup DAUN SLIM   Teh hijau  Jati Belanda   Teh Pelangsing Terbaik,24700,80 gram,1.0,nidaherbalstore,58% (34 feedback)
NEW PRODUCT Teh Insulin Salama Nusantara  Teh Daun Insulin Teh DiabetesDiabet,22500,125 gram,0.0,nidaherbalstore,58% (34 feedback)
Gelas Kopi - Gelas Teh - Gelas Air putih,6000,345 gram,30.0,nad_love08,100% (1144 feedback)
TEH KESEHATAN BLESSTEA,125000,300 gram,9.0,iglestaherbal,99% (1805 feedback)
Teh Merah Red Tea Melancarkan Pencernaan dan Penenang Saraf Murah,60000,200 gram,5.0,warna_shop,100% (2081 feedback)
Teh Bunga Rosella Merah Kering Herbalicious Sensation Pure Dried Red Rosella Tea 50gr Toples Plastik,18500,75 gram,5.0,hadyjaya,100% (58 feedback)
Teh Daun Jati Cina Original 100 Alami & 40 Herbal Organic Tea Teh Pelan,2300,50 gram,47.0,endang_tri_herawati,97% (964 feedback)
Gelas Stainless Stell Double Wall Kopi Teh Panas Dingin 180ml Gunung,38000,200 gram,11.0,belimasbro,99% (22543 feedback)
MAMA ASIX Teh Pelancar Lancar Asi Booster Tea Mama Asix Teh Kantong,119900,250 gram,3.0,smartgreenmommy,99% (600 feedback)
Teh Kesehatan Organik Ashitaba,62000,100 gram,72.0,rickynik,100% (59 feedback)
teh kulit manggis sirsak kelor anti oksidan kangker,8600,100 gram,27.0,paktou_store,98% (176 feedback)
Sendok takar kopi  coffee spoon  sendok teh stainless  tea spoon,42000,25 gram,6.0,kdedi501,99% (1067 feedback)
Infuser Saringan Seduh Teh Model Hati Love Style - Stainless steel,25000,15 gram,47.0,kraukk,97% (117 feedback)
kraft paper coklat standing 13 x 21 kantong ziplock bag berdiri klip zipper alumunium aluminium plastik kopi teh bubuk,2000,13 gram,380.0,tempatbelanje,98% (296 feedback)
Saringan Kain Thai Tea Teh Tarik Kopi,13000,50 gram,8.0,meiren,96% (15094 feedback)
GELAS MINUM CANGKIR TEH PLASTIK AW RESTAURANT AKRILIC CAFE RESTO 350 ML ASVITA,6900,100 gram,39.0,meiren,96% (15094 feedback)
Teko Saring teh / Teapot / Tea coffee pot Fiorenza 1500 ml,50000,1.0 kilogram,5.0,mokhamanocoffee,99% (4057 feedback)
Teh Rosella Merah Premium 50gr,10500,100 gram,24.0,flozindo,100% (4069 feedback)
Harga Promo Mug Kantor Gelas Cangkir Minum Air Kopi Teh Panas Dingin Stainless,21000,250 gram,12.0,buj_grosir,99% (1511 feedback)
teh celup gunung satria,6500,80 gram,28.0,goegun,99% (866 feedback)
Paket Alat Teh 2 Gayung Aluminium dan 2 Saring,110000,800 gram,8.0,superkaya,99% (1713 feedback)
BUBUK REGULER GREEN TEA 1 KG,44000,1.05 kilogram,5.0,kedaibubukjaksel,97% (1843 feedback)
