title,price,weight,count_sold,seller,feedback_seller
Teh Rosella Ungu,11000,80 gram,1.0,emalia_alim,96% (2105 feedback)
Blesstea Bless Tea Teh Hitam 70gr,85000,100 gram,9.0,lk_shop,99% (1174 feedback)
sliming (herb tea) thai.. teh hijau celup,125000,300 gram,55.0,andre_tan,99% (2891 feedback)
Teh UPET 250gr Khas Cirebon,21000,350 gram,54.0,lolla_kharisma,95% (98 feedback)
TEH GURAH NASA,65000,30 gram,0.0,triono_nasa,100% (477 feedback)
Teh Celup Daun Kelor Mengobati dan menyembuhkan reumatik,20000,100 gram,39.0,herbalhikmah,100% (17320 feedback)
Teh Bunga Kembang Chrysanthemum - teh pereda panas dalam,25500,230 gram,0.0,scb88,100% (710 feedback)
Teh Daun Insulin Teh Diabetes,25000,100 gram,3.0,lk_shop,99% (1174 feedback)
Ou Tea Original Teh Hitam,165000,100 gram,23.0,aksesoriskece212,92% (475 feedback)
sliming herb-sliming teh-simming teh-sliming tea-sliming herb tea-teh pelangsing herbal,165000,400 gram,0.0,hendry_malaikat13,99% (866 feedback)
Teh Seduh Daun Insulin Yakon Untuk Diabetes,16000,50 gram,195.0,muarateweh,96% (1206 feedback)
teh bawang dayak celup - leafy,18600,100 gram,218.0,herballeafy,99% (932 feedback)
Teh Wangi Cap Poci Superior,3300,80 gram,128.0,williamsantoso,98% (1732 feedback)
Teh Upet khas Cirebon CV Sariwangi 250gr,23000,400 gram,60.0,williamsantoso,98% (1732 feedback)
Teh kotak ultra,68000,2.3 kilogram,86.0,ia_add,99% (3403 feedback)
Mint Tea Spearmint Daun Mint Kering Teh Diet Herba Semriwing,15000,20 gram,180.0,dlimoshop,100% (328 feedback)
"BENALU TEH 100% ASLI, KEMASAN ""POUCH"" PASIR WALIK",18000,132 gram,404.0,pasir_walik,99% (608 feedback)
Teh Perut Buncit Daduzi Original Asli Jaco Tv/ Herbal Slim Tea Pelangsing,220000,300 gram,136.0,shaqstara,99% (4169 feedback)
Bak Kut Teh Song Fa,36000,150 gram,215.0,w_jayastore,98% (4509 feedback)
Sendok Teh - Kue Super Doll 00142.00014,18500,160 gram,154.0,tokoleo,97% (15758 feedback)
Teh bunda,85000,250 gram,77.0,rumahasi,98% (1731 feedback)
Teh Bandulan Tubruk 40 gram,3500,70 gram,116.0,williamsantoso,98% (1732 feedback)
teh GOPEK Celup Jasmine (TBJ/WO),8000,125 gram,174.0,tehgopekbdg,100% (78 feedback)
"Obat herbal / Teh ""Daun Sukun kering 100 gram"". hasil rawat tanaman pribadi",17500,175 gram,74.0,fredy_philip,100% (151 feedback)
OWL TEH TARIK 1 PACK ISI 20 SACHET ORIGINAL SINGAPORE,38000,350 gram,60.0,alphabetashop,97% (8539 feedback)
WALINI BLACK TEA BP 1.... Teh seduh Kualitas No. 1,29900,215 gram,150.0,walini,98% (594 feedback)
Thaitea Thai Green Tea Number One Brand Cha TraMue Teh Thailand 200g,54000,200 gram,29.0,rumahfrozen46,100% (666 feedback)
Teh Celup Angkak Asli,10000,100 gram,426.0,akhdan_herbal,97% (20135 feedback)
Teh Celup Sarang Semut  Papua,12500,100 gram,69.0,yeyeherbal,100% (15202 feedback)
Bubuk Teh Tarik Teh Hitam khusus Teh Tarik - SS Kraft Paper,40000,550 gram,63.0,gohsurono,98% (1650 feedback)
Teh NUTU Classic 40gram PEKALONGAN,3700,70 gram,98.0,williamsantoso,98% (1732 feedback)
Teh Dtoxgin Darusyifa,12000,75 gram,37.0,naylaagency,100% (12225 feedback)
PREMIUM Cangkir Kopi Keramik Ayam Jago - Mug Teh Ayam Jago Seri 2,24000,400 gram,69.0,168368,98% (1464 feedback)
Sendok Kecil Teh Kopi Stainless steel ,900,14 gram,271.0,benyguna03,94% (100 feedback)
FLAT BOTTOM ECO M 1000 1Kg coffee bag kemasan kopi 250g 500g food snak tea teh packaging kertas kraft paper kantong pouch ecer grosir,3100,17 gram,219.0,coffee_supplies,99% (1109 feedback)
Teh Celup Daun Jati Cina Gholiban,10000,90 gram,416.0,herbalwahana0101,99% (4956 feedback)
Masker bubuk organik Green Tea 10 gram masker wajah Teh hijau,3000,13 gram,109.0,harutatoys,99% (854 feedback)
Mamio Teh Tarik 30 Sachet,53000,900 gram,28.0,suprasari,98% (75 feedback)
saringan kopi - saringan teh tarik - saringan kain - saringan thai tea berbahan kain tebal buatan Thailand,22500,30 gram,314.0,indragunarto,100% (6995 feedback)
Teh Prendjak Celup,7000,100 gram,328.0,williamsantoso,98% (1732 feedback)
Teh Herbal Pegagan ,25000,150 gram,0.0,jualan_herbal,100% (4742 feedback)
natural teh persada teh hitam herbal ,30000,300 gram,12.0,siti_muslihah242,97% (119 feedback)
Teh Celup Pasak Bumi Kencono Sari Asli Murah Teh Pasutri Untuk Memelihara Kesehatan Pria,16500,120 gram,44.0,pusat_herbal_murah,100% (5385 feedback)
glucos care Teh Diabetes herbal,140000,150 gram,0.0,aman_sentosa,99% (3473 feedback)
Teh Celup Mengkudu,13000,80 gram,4.0,kabibherbal,94% (246 feedback)
Teh Herbal Daun Kelor ,25000,160 gram,5.0,jualan_herbal,100% (4742 feedback)
SARINGAN TEH PEREDAM TEH TAHAN KARAT,26100,200 gram,30.0,fadilastorebaru,100% (32 feedback)
Chinese Kipling Keepfit Tea - Teh Pelangsing,60000,180 gram,0.0,herbalalami5758,100% (26613 feedback)
Jiang zhi tea-Teh herbal tiens,135000,200 gram,8.0,michel46,99% (7054 feedback)
TEH HIJAU THAILAND THAI GREENTEA,582000,2.6 kilogram,0.0,kedaitehmedan,97% (36 feedback)
Chinese Kipling Keepfit Tea - Teh Pelangsing,60000,180 gram,0.0,herbalalami5758,100% (26613 feedback)
TEH HIJAU THAILAND THAI GREENTEA,582000,2.6 kilogram,0.0,kedaitehmedan,97% (36 feedback)
Teh Herbal Daun Kelor ,25000,160 gram,5.0,jualan_herbal,100% (4742 feedback)
SARINGAN TEH PEREDAM TEH TAHAN KARAT,26100,200 gram,30.0,fadilastorebaru,100% (32 feedback)
Teh Celup Sarang Semut ,20000,150 gram,1.0,alayubi234,100% (4379 feedback)
Bak Kut Teh,40000,116 gram,0.0,intan_puspita86,96% (603 feedback)
Jiang zhi tea-Teh herbal tiens,135000,200 gram,8.0,michel46,99% (7054 feedback)
Teh Celup Kulit Manggis ,20000,150 gram,2.0,jualan_herbal,100% (4742 feedback)
Fat Yan Tea - Teh Dewi - Teh Pelangsing,63000,150 gram,0.0,aslijaya889,99% (17664 feedback)
teh bioslim teh herbal pelangsing,95000,100 gram,2.0,bong_tjen_siong,97% (226 feedback)
Teh Daun Insulin yakon penggempur diabetes diabet,3300,80 gram,518.0,fsherbal,99% (4715 feedback)
Coffee Milk Tea Thermometer Analog Termometer Teh Kopi Susu Cairan,62000,90 gram,242.0,wanitapedia,99% (499 feedback)
Pure Green Tea powder 100g Matcha Premium bubuk teh hijau,69000,199 gram,24.0,allaboutcoffee,98% (5656 feedback)
TEH HIJAU KEPALA JENGGOT TEH GREEN TEA,12200,200 gram,52.0,elfrida_kefir,99% (1297 feedback)
teh ruqyah herbal qhi,45000,150 gram,52.0,herbalruqya_qhi,99% (800 feedback)
Teh Kayu Aro Resto,28000,550 gram,78.0,saddhashop,99% (1046 feedback)
"[JACO] DADUZI Teh hijau celup kesehatan, langsing, detox, perut buncit Original JACO /BOX/ 60 Sachet",500000,400 gram,27.0,suwella,98% (1106 feedback)
isi 6bh - Gelas Gagang Plastik Teh - Gelas Air Golden Dragon - 325ml,75000,1.0 kilogram,19.0,tokoperabotan,100% (3792 feedback)
Teh Celup Green Coffe asli,10000,100 gram,40.0,akhdan_herbal,97% (20135 feedback)
Teh Celup Sarang Semut Papua (Sarmut) UD Raya Kudus),16000,100 gram,227.0,alamherbal,100% (13186 feedback)
Teh Celup Pegagan Gholiban,11000,80 gram,78.0,herbalwahana0101,99% (4956 feedback)
Kantong Teh Celup Kosong Teabag 100PCS - White,35000,150 gram,50.0,fendy1105,100% (1568 feedback)
Sendok Teh bening Sendok pudding Ice cream Jagung manis Kue,3800,200 gram,185.0,bambangkencana,99% (4533 feedback)
Teh Tubruk Upet 250 Gr,23800,300 gram,52.0,kisthea,100% (8520 feedback)
TEH CELUP DAUN INSULIN HERBAL DIABETES ISI 20 KANTONG CELUP,10000,80 gram,237.0,kanzuherbal,96% (5952 feedback)
Jaw Sencha Tea 200 gr | Teh Hijau Jepang,55000,250 gram,116.0,distributorteh,100% (1213 feedback)
Teh Celup Herbal Kulit Manggis plus Daun Sirsak MS-Maxs,12000,100 gram,101.0,tokolamalif,99% (1293 feedback)
Teh Celup Pelancar ASI,18000,100 gram,44.0,yeyeherbal,100% (15202 feedback)
KAPSUL BENALU TEH HERBAL INDO UTAMA,27000,100 gram,32.0,herb_store,99% (1835 feedback)
KOREAN RED GINSENG TEA ( 100 sachet )  Teh Ginseng,298000,300 gram,70.0,felixpark,96% (616 feedback)
Teh Prendjak Kuning Bubuk 50gr,4000,75 gram,245.0,williamsantoso,98% (1732 feedback)
TEH TARIK Chek Hup 3in1 MALAYSIA ,62000,600 gram,50.0,darius899,100% (371 feedback)
Mama Asix - GRATIS Teh Pelancar ASI - Kasih Ibu - Dari Leafy,115500,300 gram,35.0,herballeafy,99% (932 feedback)
Teko Teh Tea Pot dengan Saringan ,39000,900 gram,39.0,tokosugih,100% (282 feedback)
Teh Herbal Daun Sirsak Anti Kanker ,5000,45 gram,650.0,gummystore,99% (4196 feedback)
Teh Seduh Bunga Rosella Merah Kencono Sari,16700,110 gram,200.0,salehaffif,99% (10831 feedback)
"Teh Gelinggang, Candle Bush Tea, Teh Ketepeng Cina, Teh Detox, Teh Diet, Teh Langsing, Slimming Tea, Teh Kesehatan, Teh Pencahar, Teh Herbal, Teh Anti Toxin",79200,250 gram,51.0,bangfajeri,100% (2065 feedback)
Teh Herbalaxsing (Pelangsing Herbal alami),55000,150 gram,61.0,naturalherbalonline,98% (651 feedback)
EVERSLIM TEA EVERWHITE - Ever White - Ever Slim Teh,68500,200 gram,39.0,ailinkosmetik,98% (47768 feedback)
Plastik Tenteng Kantong Kresek Plastik Take Away Bubble Tea - Teh Poci Cup Murah,32000,431 gram,543.0,serba_serbi_serbu,98% (1970 feedback)
Teh Bunga Rosela Ungu KencanaSari ,15000,200 gram,0.0,ggherbal,99% (1280 feedback)
Owl Teh Tarik Instant Malaysia 20 Sachet 340g,35000,400 gram,8.0,mulia_panca_rezeki,97% (137 feedback)
"Teh Celup 3 In 1 | Teh Hijau, Kulit Manggis, Dan Sirsak Untuk Antioksidan",20000,120 gram,27.0,alamiherbal,100% (11812 feedback)
Teh Daun Insulin yakon penggempur diabetes diabets,5700,90 gram,0.0,pelangiherbal,100% (17 feedback)
Teh Tin 69,50000,20 gram,2.0,warungmuara,97% (300 feedback)
Teh Celup  Bidara,13900,40 gram,2.0,buta_ijo,100% (33 feedback)
herbulgari teh herbal alami ampuh untuk syaraf kejepit terapi stroke rematik dll 1pack isi 10sachet ,240000,100 gram,38.0,garuda789,99% (1770 feedback)
Fei Yan Health Tea - Teh Pelangsing herbal,85000,230 gram,0.0,scb88,100% (710 feedback)
Teh Celup Jati Cina,15000,100 gram,0.0,naren_herbal,100% (261 feedback)
TEH GURAH ASLI NASA ,65000,35 gram,0.0,herbal_nasa72,100% (28 feedback)
Teh Hijau Asli atau Green Tea Alami Jenis Peko Super,7000,120 gram,122.0,tehaslinusantara,100% (47 feedback)
TEH DADUZI NEW,1360000,1.0 kilogram,0.0,shinta_steviani_modjo,100% (23 feedback)
TEH GURAH HERBAL NASA,65000,150 gram,0.0,mila_nuraini786,99% (242 feedback)
French Press 600 Ml IPlunger Coffee I Coffee Maker I Penyaring Kopi Tanpa Ampas I Bisa Untuk Seduh Teh,99000,700 gram,,kopiaddict,99% (4216 feedback)
Teh Celup Jati Cina,15000,100 gram,0.0,naren_herbal,100% (261 feedback)
Teh Daun Insulin yakon penggempur diabetes diabets,5700,90 gram,0.0,pelangiherbal,100% (17 feedback)
SARINGAN TEH MINYAK TEPUNG JUS STAINLESS STEEL HHD-213,19000,100 gram,184.0,serba10,95% (15932 feedback)
Teh Gurah - Teh untuk kesehatan,65000,150 gram,0.0,nina_arkana895,100% (24 feedback)
TEH HITAM ORIGINAL NASA,25000,150 gram,0.0,mamawahyu1980,99% (276 feedback)
Teh Seduh  Curah Daun Kelor herbal plastik bening,3000,45 gram,498.0,pesonaherbal756,95% (6225 feedback)
Teh Daun Bidara - Herbal Ruqyah Rehab Hati,35000,200 gram,91.0,pananyaherbal,96% (1579 feedback)
Premium Pure Matcha Greentea (Teh Hijau) Powder Pack 100 gram,63000,120 gram,231.0,leegunner,97% (490 feedback)
Daun Benalu Teh Original,70000,500 gram,71.0,ipulcr07,96% (561 feedback)
Teh YAMAKAEN,68000,110 gram,47.0,nellytss,96% (1761 feedback)
teko stainless kettle teko teh teko kopi 1200ml murah,140100,500 gram,26.0,fello1989,98% (2712 feedback)
Sachet 25 Gram 8x12 Cm Kemasan BAG Full Alumunium Foil Silver teh bubuk kopi masker,111000,680 gram,21.0,yonkming,98% (1677 feedback)
TWININGS English Breakfast ..TWININGS Earl Grey Tea ..Teh Twining ,87800,200 gram,71.0,jiisoii,99% (1083 feedback)
Teh Rumput Teki isi 24 Sachet,250000,100 gram,250.0,iwanhendrag,100% (386 feedback)
Teh Celup Hijau - Green Tea Gholiban,10000,90 gram,114.0,herbalwahana0101,99% (4956 feedback)
Meja Ngopi Bulat Samping - Small Round Coffee Tea Table - Meja Kopi Teh,85000,1.574 kilogram,34.0,tokovalet,99% (48129 feedback)
Bioslim Herbal Tea Bio Slim Teh Pelangsing Badan Tubuh Perut,105000,200 gram,28.0,suhendy2005,98% (1888 feedback)
Sendok Bayi - Sendok Teh Melamin Full Color,1500,8 gram,30.0,arie_somantri_hakim,99% (545 feedback)
Teh Celup Cap Naga,7500,130 gram,192.0,distributorteh,100% (1213 feedback)
Teh Bunga Rosella Ungu Kencono Sari Original,29000,200 gram,44.0,topmanagercilegon01,100% (33464 feedback)
teh bunga rosella ungu binrais,18000,120 gram,105.0,jncollectionindo,100% (1044 feedback)
teh jati cina aur Life a Herbal ,3500,60 gram,1193.0,kiosherbalsinta,99% (2990 feedback)
Kantong Teh Celup Kosong Teabag 100PCS - White,34500,250 gram,21.0,one_colection,100% (250 feedback)
TEH CELUP DAUN KELOR MORINGA ,12500,100 gram,605.0,almanna_herbal,99% (706 feedback)
Daun Teh Insulin ,8000,55 gram,359.0,wisataherbal,100% (656 feedback)
Teh botol pet 350ml,38000,1.5 kilogram,66.0,ia_add,99% (3403 feedback)
Teh 999 Teh asli Solo,3300,80 gram,111.0,williamsantoso,98% (1732 feedback)
Jiaogulan Teh,60000,80 gram,49.0,edyaciu,99% (4863 feedback)
WALINI KLASIK BLACK TEA / TEH HITAM,17000,200 gram,134.0,walini,98% (594 feedback)
SHUMA 1600 Teko Termos Air Panas Kopi Teh Stainless Merek Terbaik,234000,1.297 kilogram,55.0,capgomart,99% (2864 feedback)
Teh Rosella Merah Premium 100gr,17500,300 gram,37.0,flozindo,100% (4066 feedback)
Delixia liang teh untuk panas dalam herbal alami,18000,250 gram,59.0,herbaleo,99% (544 feedback)
Sendok teh stainless,10000,200 gram,77.0,gabriel514,99% (1419 feedback)
Teh Celup Herbal Daun Insulin - UD Raya Kudus,13500,110 gram,624.0,alamherbal,100% (13186 feedback)
SHUMA 800 Teko Termos Air Panas Kopi Teh Stainless Merek Terbaik,149400,760 gram,60.0,capgomart,99% (2864 feedback)
TEH HIJAU KEPALA DJENGGOT,12500,145 gram,336.0,srilanny,98% (97 feedback)
Teh Celup Daun Ashitaba Tanaman Panjang Umur,37500,60 gram,9.0,achyasin28,99% (458 feedback)
TEH GURAH ASLI NASA ,65000,35 gram,0.0,herbal_nasa72,100% (28 feedback)
Teh Celup Daun Insulin Gholiban,13000,80 gram,3.0,kabibherbal,94% (246 feedback)
Teh Daun Jati Cina Kencono Sari,5000,50 gram,49.0,falahherbal,96% (1026 feedback)
TEH Pelangsing Herbal,73000,150 gram,0.0,mamawahyu1980,99% (276 feedback)
BIOSLIM TEH CELUP,125000,300 gram,0.0,denny_chi450,100% (1645 feedback)
Teh Jati Belanda,19500,50 gram,0.0,baskara_herbal,99% (993 feedback)
Natural Teh Persada - NTP - Agen Nasa Bekasi,24000,350 gram,3.0,ekka_cournelly,100% (225 feedback)
blesstea Bless tea teh hitam sachet isi 25 ,90000,100 gram,2.0,achion_lim102,91% (2008 feedback)
Natural Teh Persada,24000,200 gram,0.0,nina_arkana895,100% (24 feedback)
TEH HITAM ORIGINAL NASA,25000,150 gram,0.0,mamawahyu1980,99% (276 feedback)
Bioslim Teh - Teh pelangsing herbal & melancarkan BAB,100000,130 gram,1.0,scb88,100% (710 feedback)
teh bawang dayak,19000,50 gram,0.0,qodi_husen,100% (212 feedback)
Natural Teh Persada - NTP - Agen Nasa Bekasi,24000,350 gram,3.0,ekka_cournelly,100% (225 feedback)
Teh Mahkota Dewa,15000,200 gram,4.0,ggherbal,99% (1280 feedback)
Teh Jati Belanda,19500,50 gram,0.0,baskara_herbal,99% (993 feedback)
Teh Seduh  Curah Daun Kelor herbal plastik bening,3000,45 gram,498.0,pesonaherbal756,95% (6225 feedback)
Kapsul Pelangsing.. Teh Jati,75000,80 gram,0.0,kantinkita,97% (1228 feedback)
TEH PELUNTUR LEMAK TPL solusi kurus original,70000,100 gram,20.0,herlina_kasimin,99% (14919 feedback)
TEH PELANGSING SINENSA - SINENSA GREEN TEA HERBAL,40000,100 gram,6.0,wireman,99% (1167 feedback)
Sendok Teh Premium Stainless Steel Superdoll - Super Doll Tea Spoon,3500,35 gram,182.0,tasikjaya,94% (4714 feedback)
Thai tea Number One Chatramue Brand 400 gram Daun Teh Thailand Original,56900,500 gram,24.0,uspur,92% (14099 feedback)
Kedaung Super Doll 405 Tea Spoon Sendok Teh kecil Stainless steel,18500,120 gram,45.0,dinamisjakarta,96% (15942 feedback)
Teh Celup Daun Sirsak Gholiban,10000,80 gram,92.0,herbalwahana0101,99% (4956 feedback)
Kantong Plastik Pop Ice / Teh Poci / Bubble Tea Warna Uk.1 Dan 2 Cup,4000,100 gram,329.0,sese,96% (4638 feedback)
Kantong teh segitiga ukm 50 pcs plus benang food grade,10000,20 gram,108.0,henny_dimayanti08,100% (678 feedback)
Teh Hijau cap Kepala Djenggot 60 gram,14000,300 gram,104.0,mawix,100% (7436 feedback)
Teh Celup Daun Kersen,75700,100 gram,73.0,mirapuraid,99% (135 feedback)
Teh Hijau Asli Cap Daun Mas [Best Seller],14000,200 gram,161.0,harits_herbal,99% (6691 feedback)
Sosro Teh Botol Original 330 ml isi 3,10000,1.3 kilogram,15.0,coklatkilomalang,99% (3479 feedback)
Benalu Tablets (Benalu Teh-85),38000,80 gram,86.0,mandjur,99% (40212 feedback)
Teh Celup Daun Tin,16500,100 gram,623.0,yeyeherbal,100% (15202 feedback)
Teh Putih Curah / Kiloan,75000,75 gram,91.0,distributorteh,100% (1213 feedback)
Paket 9 Teh Tubruk : Teh Gardu Teh Jenggot Teh 999 Teh Nyapu Teh Poci Teh Sintren Teh Gopek Teh Dandang,30000,585 gram,150.0,pusatgrosireceran,100% (11115 feedback)
Enam pasang Cangkir Set seri 7 Ayam Jago seri 2 - Cangkir Kopi - Teh,123000,3.0 kilogram,32.0,168368,98% (1464 feedback)
TERMURAH Teh Rosella Merah BIN RAIS,15000,150 gram,132.0,naylaagency,100% (12225 feedback)
Teh Putih Premium - Gamboeng White Tea Refill 50gr,100000,60 gram,78.0,gamboengwhitetea,96% (57 feedback)
Teh Wangi  Cap  GOPEK (Teh Tubruk Tradisional Dengan Bunga Melati) Traditional Tea With Jasmine Flower (Daun Teh Pilihan),3300,65 gram,127.0,pusatgrosireceran,100% (11115 feedback)
Chek Hup Teh Tarik ChekHup 3in1 Malaysia Tea With rock Sugar 15sachet,69000,650 gram,167.0,surgabuku,95% (4698 feedback)
Teh daun jati cina peluntur lemak,3500,50 gram,737.0,atika_mulyadi379,97% (1292 feedback)
Kuramo Kunyit Mas Obat Asam Lambung Maag Gerd Kronis Teh Herbal Kuat,165000,300 gram,74.0,keightstore,94% (130 feedback)
Teko listrik stainless 11 cm pemanas air rebus indomie kopi teh teko kuah electric heating cup MURAH,42500,500 gram,60.0,delauraserafina,97% (3350 feedback)
"[JACO] DADUZI Teh hijau celup kesehatan, langsing, detox, perut buncit Original JACO /BOX/ 30 Sachet",255000,250 gram,132.0,suwella,98% (1106 feedback)
BENANG KANTONG TEH FOOD GRADE 200 m,14000,30 gram,60.0,henny_dimayanti08,100% (678 feedback)
Sendok Puding - Sendok Plastik Kecil - Sendok Rujak - Sendok Teh,100,5 gram,2080.0,vellyanatasia,97% (2083 feedback)
Teh jati cina curah asli,3000,65 gram,1564.0,akhdan_herbal,97% (20135 feedback)
Gelas Ajaib Untuk Minum Kopi Teh Dan Susu,37600,800 gram,151.0,gerrygokil,99% (30897 feedback)
TEH DAUN SENNA / JATI CINA. TEH PENURUN BERAT BADAN,28000,70 gram,47.0,omahjamuonline,99% (23551 feedback)
"TEH HIJAU SUPER (pecco +2) EXPORT QUALITY 100% ALAMI, CURAH KILOAN PASIR WALIK",125000,1.11 kilogram,23.0,pasir_walik,99% (608 feedback)
MAMABEAR Teh Pelancar ASI - Asi Booster PRAKTIS,42000,150 gram,381.0,arbybabynkids,99% (11299 feedback)
Kapsul Teh Hijau Tegreen 120 Kapsul,690000,120 gram,1.0,rosivabeautyshop,100% (270 feedback)
mei zi tang teh tea diet,70000,100 gram,4.0,herlina_kasimin,99% (14919 feedback)
Sinensa Green Tea Herbal Teh Pelangsing asli,50000,150 gram,0.0,alien_alien,100% (91 feedback)
Teh Bunga Chrysanthemum - Teh Pereda panas dalam,35000,110 gram,1.0,scb88,100% (710 feedback)
Teh Bunga Rosella Merah Kencono Sari Curah,25000,120 gram,22.0,jualan_herbal,100% (4742 feedback)
Murbei Teh Herbal Untuk Kesehatan,60000,125 gram,0.0,johnsuper4566,100% (512 feedback)
TEH OLONG FUJIAN CHINA ASLI OOLONG TEA EXP 2019,65000,250 gram,11.0,aneka_herbal_komplit,99% (1331 feedback)
Bunga Telang Kering 10gr - Teh Bunga Telang - Blue Tea - Teh Biru - Butterfly Pea Tea,12000,20 gram,3.0,epipio,100% (10 feedback)
HIU Benalu Teh,40000,80 gram,1.0,herbaltum,88% (1009 feedback)
ZURIATEA TEH ZURIAT PROGRAM HAMIL PROMIL ZUPERMOM PENYUBUR MURAH,149000,300 gram,3.0,tokosayajakarta,100% (8 feedback)
sencha bubuk. serbuk teh hijau @250gram,39000,250 gram,31.0,juariyah22,99% (3851 feedback)
Teh Bunga Chrysanthemum - Teh Pereda panas dalam,35000,110 gram,1.0,scb88,100% (710 feedback)
Kunyit Putih Benalu Teh,52300,250 gram,0.0,herbalqu,100% (215 feedback)
Murbei Teh Herbal Untuk Kesehatan,60000,125 gram,0.0,johnsuper4566,100% (512 feedback)
Obat Herbal Tumor Dan Kanker Payudara Dari Kalimantan Tengah Akar Kayu Bajakah Kering Dijamin Asli Bonus Teh Gunung Satria,250000,100 gram,61.0,kuahsoto,100% (275 feedback)
Bodha kemasa Gede FM & Free teh bodha,100000,1 gram,3.0,claudia626,85% (7 feedback)
MOUNTEA HOME TEH MANIS 290ML - KARTON,46300,6.0 kilogram,1.0,fbonlineshop,95% (9884 feedback)
Asiboostertea Teh Pelancar ASI  Fenugreek Plus ,120000,360 gram,0.0,nineonbabybags,98% (527 feedback)
Daun Teh Jati Cina 1 kg,65000,1.0 kilogram,0.0,aurelshop008,99% (334 feedback)
Teh Celup Jati Cina | Teh Jaticina Pelangsing Tubuh Alami ,13000,100 gram,35.0,alamiherbal,100% (11812 feedback)
Teh 63 Cha Wang,180000,100 gram,19.0,onlinetokoteh63,95% (111 feedback)
mama bear teh pelancar asi,38000,300 gram,57.0,tomatobabyshop,99% (1554 feedback)
Teh Naga Malang,51000,900 gram,450.0,radik_wikanto,100% (1468 feedback)
Cangkir 180 Ceper Putih Gelas Kopi Teh Perlengkapan Kafe ,45000,450 gram,64.0,barangcantikunik,99% (943 feedback)
Teko Stainless Fujika 1.5 L Ceret anti karat & Saringan kopi teh,80000,500 gram,62.0,sungphin,100% (2190 feedback)
BUNGA ROSELLA KERING  TEH BUNGA ROSELA  KUALITAS SUPER ROSELA MERAH,13500,120 gram,26.0,pancoran_herbal_store,99% (1859 feedback)
Kapsul Teh Hijau Tegreen 97- 120 Kapsul,555000,200 gram,14.0,trueolshop,100% (5239 feedback)
Teh Hijau Cap Pucuk,15000,150 gram,635.0,tintus_darmawan,100% (499 feedback)
teh jati cina hikmah aur ,3500,60 gram,1023.0,kiosherbalsinta,99% (2990 feedback)
teh janaa,67500,100 gram,146.0,sahabat_fresh,99% (1601 feedback)
Teh Moringa,14000,110 gram,274.0,alamherbal,100% (13186 feedback)
liang teh medan gicha 200gram,18000,150 gram,124.0,herman_tienk,97% (40 feedback)
DAUN KELOR TEH,4000,47 gram,446.0,nasir78,99% (8296 feedback)
MAXCREAMER 500GR UNTUK TEH PUDDING KOPI DLL,27500,580 gram,111.0,hermanali99,98% (11273 feedback)
GOALPARA BLACK TEA / TEH HITAM CELUP 30's,5900,135 gram,241.0,walini,98% (594 feedback)
sendok kopi sendok takar kopi teh susu bubuk,5000,15 gram,224.0,langith03,98% (53 feedback)
Pure Dried Red Rose Buds Teh Bunga Mawar Merah Kering Flower Tea Hips,53500,150 gram,24.0,nihoncha,99% (646 feedback)
"[JACO] DADUZI Teh hijau celup kesehatan, langsing, detox, perut buncit Original JACO / Eceran Sachet",9500,10 gram,452.0,suwella,98% (1106 feedback)
Matcha Japanese Green Tea Powder ( Bubuk Teh Hijau Jepang ) - 250gr,252600,310 gram,19.0,nihoncha,99% (646 feedback)
TERMURAH Teh Celup Daun Insulin Yakon Diabetes,10900,80 gram,384.0,naylaagency,100% (12225 feedback)
Gelas Tumbler Mug Lensa Kamera Camera Lens Botol Minum Kopi Teh Coffee Tea Softdrink,89900,300 gram,42.0,granss,100% (4085 feedback)
Teh Up Green Tea CNI,85000,175 gram,47.0,etenth,100% (9197 feedback)
THAI TEA THAITEA NUMBER ONE BRAND CHATRAMUT BRAND TEH THAILAND 400 GR,68000,420 gram,75.0,aneka_herbal_komplit,99% (1331 feedback)
Teh Sanna Al Sunnah,32000,100 gram,757.0,ziastore,99% (790 feedback)
Sendok Teh dan Garpu Kue Stainless Steel,25100,200 gram,105.0,diza_shop,100% (299 feedback)
Tianshi jiang zhi teh..40sachet,131300,200 gram,25.0,pie18,99% (14566 feedback)
teh diet etham ,68000,100 gram,30.0,ranthyarts,99% (1171 feedback)
TEH HIJAU SUPER KEPALA DJENGGOT 150gr,30000,240 gram,135.0,srilanny,98% (97 feedback)
Teh Celup Daun Insulin,8000,60 gram,193.0,rumahherbal999,96% (51 feedback)
Sendok Puding 50pcs Per Pack Sendok Eskrim Besar Teh STG Plastik Murah,3700,70 gram,72.0,trigunajayasurabaya,99% (602 feedback)
BOOSTER ASI PRAKTIS BENTUK TEH KANTONG - TEH PELANCAR ASI,170700,300 gram,290.0,superstorebaru,100% (66 feedback)
WALINI JASMINE TEA / TEH WANGI MELATI,17000,125 gram,82.0,walini,98% (594 feedback)
Coffee and Tea Infuser Pot 900ml Push Button Kaca Saringan Teh Kopi,89000,650 gram,11.0,viralshop87,96% (17736 feedback)
Teh Biru Organik Bunga Telang Buterfly Pea Flower 30 gr,55000,200 gram,1.0,ggherbal,99% (1280 feedback)
French Press 350 ml IPlunger Coffee I Coffee Maker I Penyaring Kopi Tanpa Ampas I Bisa Untuk Seduh Teh,85000,500 gram,,kopiaddict,99% (4216 feedback)
TEH CELUP HERBAL DAUN KELOR KENCONO SARI,20000,100 gram,0.0,fadhlika_fikri,100% (486 feedback)
teh jaticina teh racik herbal pelangsing laris,11000,50 gram,0.0,olivia_salsa_bila,100% (1582 feedback)
TEH CELUP HERBAL JATI BELANDA 20 KANTUNG,25000,100 gram,2.0,fadhlika_fikri,100% (486 feedback)
Teh Celup Daun Jati Cina Griya Herba Original JATCINTEA Asli Murah Teh Pelangsing Penurun Berat Badan,14500,120 gram,70.0,pusat_herbal_murah,100% (5385 feedback)
TEH CELUP DAUN INSULIN HIKMAH,68000,100 gram,3.0,darren_zhang,99% (7067 feedback)
TEH CELUP HERBAL DAUN KELOR KENCONO SARI,20000,100 gram,0.0,fadhlika_fikri,100% (486 feedback)
Rose Buds 10g - Kuncup Mawar Kering - Bunga Mawar Kering - Rose Bud - Rose Tea - Teh Mawar,9000,20 gram,6.0,epipio,100% (10 feedback)
teh jaticina teh racik herbal pelangsing laris,11000,50 gram,0.0,olivia_salsa_bila,100% (1582 feedback)
Teh celup sosro 50bags,9500,300 gram,0.0,oshop_oshop,97% (1441 feedback)
Teh Celup Daun Jati Cina Griya Herba Original JATCINTEA Asli Murah Teh Pelangsing Penurun Berat Badan,14500,120 gram,70.0,pusat_herbal_murah,100% (5385 feedback)
Daun Teh Herbal Ampuh Mengatasi Diabetes,125000,200 gram,2.0,amanshop888,100% (8956 feedback)
teh helbugari herbal original-teh rematik pegal linu encok teh helbugari 1 pak isi 10 sahcet,245000,250 gram,9.0,hendry_malaikat13,99% (866 feedback)
saringan kopi teh susu bahan kain,11900,30 gram,204.0,betuah_shop,99% (351 feedback)
Teh Merah Rooibos  celup Premium Penggemuk & penambah nafsu makan RED TEA ACTIVA Hight Quality,60000,100 gram,3.0,umi_green_tea,97% (42 feedback)
Bubuk Thai Tea 1kg - Serbuk Minuman Teh Thailand - Bandar Powder,70000,1.12 kilogram,3.0,bandarpowder,97% (327 feedback)
Teh  Daun Jati Cina Plus Rosella Merah Celup,8500,180 gram,95.0,grosir_herbal_sinta,99% (115 feedback)
Thai Green Tea Number One Brand 200gr Teh Hijau Thailand 200 gr,55000,200 gram,169.0,boatwthsix,94% (870 feedback)
SUPER DOLL Sendok Teh Kecil Stainless Steel Tea Spoon isi 6 Pcs Perdus,18900,200 gram,91.0,alfon_0y4m4,97% (2093 feedback)
Tong Tji - Teh Jeruk Purut - Tea Bag-Teh Celup ,11000,110 gram,135.0,tongtjiofficialstore,93% (250 feedback)
Teh Jawa,3500,55 gram,297.0,ary_murdiyati,98% (2041 feedback)
