title,price,weight,count_sold,seller,feedback_seller
Sendok Teh / Spoon / Teaspoon Elegant Stainless Steel Polos - 6 pcs,33000,200 gram,176.0,ybhouseware,100% (759 feedback)
Gelas Cangkir tempat minum OWL 350 ML akrilik jus kopi teh plastik melamin,8000,150 gram,224.0,maria_maria314,98% (2015 feedback)
Teko teh thai tea news produk,82500,2.0 kilogram,94.0,hardi_ahmad_triwahyudi,98% (97 feedback)
sendok atau garpu teh kue doll,18000,300 gram,44.0,savio_housewares,93% (5871 feedback)
Teh Celup Daun Pegagan,10500,100 gram,91.0,yeyeherbal,100% (15202 feedback)
Teh Tubruk 3 In 1,37000,600 gram,28.0,ary_murdiyati,98% (2041 feedback)
Bunga Telang Butterfly Pea Flower Bunga Biru Teh Herbal Bunga Telang  Isi 100 Gram,149000,130 gram,34.0,dimariaangel070,96% (1775 feedback)
Teh Celup Sirsak Manggis Original,7500,100 gram,144.0,akhdan_herbal,97% (20135 feedback)
Teko teh kopi dengan saringan 1100ml 1.1 liter kaca tea pot glass elegan murah,42000,600 gram,37.0,megichen,99% (2346 feedback)
ASI Booster Mama Bear Teh Pelancar ASI - Isi 20 Kantung Teh,42000,150 gram,25.0,wedang101,98% (854 feedback)
CHING KAN CHA HEPA TEH OBAT SAKIT KUNING GEJALA LIVER SERING MASUK ANGIN,40000,150 gram,46.0,kishen171116,100% (1705 feedback)
TEH DAUN TIN (TEH CELUP),12500,60 gram,759.0,gatottripranoto,100% (355 feedback)
sedotan&Sedotan stainless pengaduk teh ,14000,12 gram,34.0,syamsudin_martina,99% (1153 feedback)
teh daun jati cina organik,5000,60 gram,224.0,nasir78,99% (8296 feedback)
"Fat Yan Tea - Mei Fah Brand - Teh Dewi / Teh Untuk Diet, Turun Berat Badan, Kurus",65000,400 gram,39.0,toko_obat_hauw,99% (1028 feedback)
ichi ocha teh melati 350ml,109000,40 gram,358.0,sugeng_santoso30,99% (877 feedback)
Bubuk Reguler Teh Tarik 1Kg,44000,1.1 kilogram,37.0,javalandcoffee,97% (6041 feedback)
MAMABEAR TEH PELANCAR ASI,40000,200 gram,73.0,babyklik,100% (19390 feedback)
Teh Seduh Daun Insulin Yakon Diabetes Kencono Sari,5900,65 gram,317.0,gresikherbal,98% (1119 feedback)
Tempat Teh Besi Stainless Wadah Saringan Teh Bulat  X101,7000,60 gram,90.0,harikushop,96% (658 feedback)
SHUMA VACUUM MUG-TERMOS MUG LEATHER - TERMOS GELAS KOPI DAN TEH 600 ML ,130000,700 gram,23.0,bayionlineshop,95% (3483 feedback)
LIANG TEH,9000,100 gram,320.0,healthy_herbal,99% (2655 feedback)
Teh Daun Jati Cina 200 Gram ORIGINAL 100% Alami (Herbal Organik),20000,200 gram,80.0,silvia_goei,99% (13633 feedback)
Teh Seduh Daun Jati Cina Membantu susut diet lemak Pelangsing,5200,40 gram,71.0,salehaffif,99% (10831 feedback)
Teh Bawang Dayak kering herbal,20000,80 gram,55.0,myhealth,98% (7734 feedback)
Pengharum Parfum Mobil - VL Scents Block GREEN TEA - TEH HIJAU,25000,70 gram,5.0,niehashofia,100% (442 feedback)
Gusset Teh Celup per 1000 pcs,300000,3.0 kilogram,9.0,kemasanjayaindo,99% (590 feedback)
Teh Celup Daun Sirsak Plus Keladi Tikus,15000,100 gram,37.0,hikmahjakarta,99% (231 feedback)
Teh hijau pelangsing herbal GREEN TEA ACTIVA botol 40 gram halal depkes,40000,45 gram,30.0,umi_green_tea,97% (42 feedback)
TEH BENALU KOPI SEGAR 500 GRAM obat herbal,35000,520 gram,1.0,yusuf_nasrulloh331,96% (28 feedback)
Teh Daun Kelor Murni Kwalitas Premium 100gr,19500,200 gram,26.0,flozindo,100% (4066 feedback)
Teh Bunga Rosela Merah Kencanasari ,15000,200 gram,0.0,ggherbal,99% (1280 feedback)
Shaker teh.. cocok buat gym,45000,250 gram,0.0,pie18,99% (14566 feedback)
Bioslim  Teh - Teh pelangsing &  Melancarkan BAB,105000,120 gram,0.0,herbalalami5758,100% (26613 feedback)
teh herbal sarang semut 20 kantung teh,25000,100 gram,0.0,ratnarahmawati231,100% (69 feedback)
